article,category,date,source,title
문재인 정부가 황희 문화체육관광부 장관을 베이징동계올림픽 정부 대표로 파견하기로 정하고 박병석 국회의장도 개막식에 참석한다고 밝히면서 미국을 의식해 대통령 방문은 자제하되 중국을 배려해 의전서열  인사가 올림픽을 찾는 절충안이라는 분석이 나온다 한국 주요국이 전통적 우방인 미국과 경제 파트너인 중국 사이에서 묘수를 찾고자 고심하는 가운데 과연 미국의 외교적 보이콧 선언은 어느 정도 효과를 발휘했을까  현재 공식적으로 외교적 보이콧을 천명한 나라는 대만을 포함해  정도다 지난해   백악관은 올림픽에 선수단을 파견하되 정부 사절단은 보내지 않겠다며 외교적 보이콧을 선언했다 신장 위구르자치구에서 벌어지는 인권 탄압 등을 이유로 들었다 곧바로 미국의 최상위 정보 동맹인 영국과 캐나다 호주가 동참 의사를 밝혔고 일본도 대표단에 정부 고위 관리를 내세우지 않기로 했다 유럽 국가인 리투아니아도 독자적으로 외교적 보이콧을 선언했다 이후 벨기에와 덴마크 에스토니아 코소보 정도가 합류했다 뉴질랜드와 오스트리아 슬로베니아 스웨덴 네덜란드 스위스 등도 올림픽에 정부 대표단을 보내지 않기로 했지만 이들 국가가 내세운 불참 이유는 코로나19 방역이다 독일은 외교 체육장관이 개인적 소신을 내세워 올림픽 참석을 거부했다고 밝혔다 감염병 확산을 우려해 불참을 발표한 나라를 더해도  넘지 않는다 특히 깐부 같은 유럽연합 EU 소극적 태도가 뼈아플 수밖에 없다 차기 올림픽 개최국인 프랑스  이탈리아  포함해 대다수가 정부 대표단을 파견해서다 여기에는 외교적 보이콧이 중국의 인권 상황을 개선하는 도움이 되지 않을뿐더러 되레 미중 패권경쟁 국면에서 미국의 들러리만 주는 꼴이 있다는 판단이 자리잡고 있다 지난해  미국이 유럽을 배제하고 앵글로 색슨 동맹 오커스 미국 영국 호주 출범시킨 대한 반감도 작용했다 정치매체 폴리티코는 이런 저조한 실적은 중국의 권위주의적 탄압에 맞서 글로벌 연합체를 만들어야 미국의 위상과 신뢰를 약화시킨다고 전했다 이와 관련해 왕이 중국 외교담당 국무위원 외교부장 장관 이날 토니 블링컨 국무장관에게 미국이 베이징올림픽을 방해하는 것과 대만 문제로 카드놀이를 하는 것을 즉시 중단하라고 촉구했다고 중국 외교부가 전했다 국무위원은 양국 정상은 지난해  화상회담에서 미중 관계의 건전한 발전을 위한 방향을 제시했다 그러나 미국은 여전히 중국에 관한 잘못된 언행을 쏟아 양국 관계에 충격을 주고 있다고 비판했다 이에 대해 블링컨 장관은 양국 정상회담에서 바이든 대통령이 밝힌 입장에는 변화가 없다며 미중 사이에 이견이 있는 만큼 미국은 책임 있는 자세로 이견을 관리하겠다는 입장이라고 응수했다,국제,20220128,서울신문,올림픽 보이콧 10개국뿐.. 전통 우방·경제파트너 사이 묘수 찾기
아빠를 위해 낙서로 맞춤 제작한 나이키 운동화가 스포츠 브랜드 나이키 관계자의 눈에 띄었다 수업 시간에 낙서를 하다가 선생님께 꾸중을 듣던 영국의  소년이 나이키 디자이너가 순간이다 지난  현지시간 영국 일간지 더타임스 미러 등에 따르면 영국 슈루즈베리에 사는 웨일 군은 최근 나이키와 수십억달러 규모의 계약을 맺었다 조는 온라인에서 나이키를 홍보하고 어린이들의 창의적인 활동을 격려하는 프로모션에 공동 크리에이터로 참여할 예정이다 조는 이미 유명 인사다 웨일이 운영하는 낙서 소년 the doodle boy 인스타그램 계정은  팔로워를 거느리고 있다 하지만 그의 작품 활동이 처음부터 순탄한 것은 아니었다 수업시간에 그림을 그린다는 이유로 선생님한테 지적당하고 혼나는 일이 다반사였다 결국 조의 부모님은 그를 방과 미술 클럽에 보냈는데 선생님이 조의 재능을 알아봤다 그의 아버지는 더타임스에 이야기는 아이가 학교에서 충분히 그림을 배우지 못했다는 것에서 시작한다며 우리는 그를 미술 수업에 보냈고 다행히 선생님이 재능이 있다는 것을 알아챘다고 말했다 이후 조는 선생님의 도움을 받아 작품 일부를 온라인에 올렸고 이후 입소문이 퍼지기 시작했고 많은 이들의 관심을 받았다 병원과 식당 등에서도 협업 의뢰가 들어왔고 어린이 소설의 삽화도 맡았다 영국 윌리엄 왕자 부부에게 고용돼   그들의 투어를 기록하기도 했다 나이키와의 인연은  아버지의 날을 위해 낙서로 맞춤제작한 나이키 트레이너 운동화 사진을 온라인에 올리면서 시작됐다 사진으로 그의 그림이 나이키 측의 눈에 것이다 조는 나이키와의 협업에 대해 나이키는 정말 대단하고 내가 기대하고 있는 재밌는 것들이 많이 나올 것이라면서 이건 하나라고 말했다 그림을 그리면 행복해진다는 그는 화가 나면 방에 가서 낙서를 하기 시작한다 내가 하는 가장 편안한 하나라고 전했다 이어 자신에게 좋아하는 하라고 말한다 그게 낙서다 굉장히 기분이 좋고 자신이 자랑스럽다고 덧붙였다,국제,20220127,서울신문,"아빠 운동화에 낙서한 英 12살 소년, 나이키 사로잡았다..디자이너 발탁"
국제유가 벤치마크인 북해산 브렌트유 가격이  만에 배럴당  넘어섰다 우크라이나 침공설 지정학적 위기에 에너지 대란이 가시화하고 있다  현지시간 런던 ICE선물거래소에서  브렌트유는 배럴당  찍으며    이후 최고가를 기록했다 뉴욕상업거래소의  서부텍사스산원유 WTI  거래를 마치며 역시   이후 가장 높은 수준에 올랐다 일촉즉발로 치닫는 우크라이나 사태와 중동 지역의 군사 충돌 지정학적 긴장이 촉발한 공급 우려가 국제유가를 올렸다고 AFP통신은 설명했다 석유수출국기구 OPEC 국제에너지기구 IEA 등이 올해 석유 수요가 글로벌 경제성장에 따라 코로나19 전인  석유 수요를 웃돌 것으로 예상한 역시 유가를 끌어올리고 있다 CIBC프라이빗웰스의 레베카 바빈 수석 에너지 트레이더는 우크라이나와 러시아의 갈등이 완화 국면에 접어들기 전까지 국제유가의 매수세가 강해질 것이라고 내다봤다 스탠더드앤드푸어스 글로벌플랫츠의 셸던 최고 지정학 고문은 시장은 물리적인 원유 공급이 차질을 빚을 있다는 점에서 불안해하고 있다고 말했다 이날 미국 원유 재고는 증가했지만 유가 상승을 막지 못했다 지정학 공포가 높은 탓에 공급 불안이 미국의 공급 여력보다 크게 작용한 것이다 앞서 골드만삭스는 올해  브렌트유 가격이 배럴당  치솟을 있다고 전망했다 골드만삭스는 투자자들에게 보낸 서한에서 코로나19 발발 이후 원유시장은 공급 교란 가능성에 취약해졌다고 언급했다,국제,20220128,서울신문,우크라 전쟁 공포에.. 브렌트유 7년 만에 90달러 넘었다
한미일  다음달 중순쯤 하와이에서 외교장관 회담을 개최하는 방향으로 조율 중이라고 교도통신이 복수의 외교 소식통의 말을 인용해  보도했다 보도에 따르면 한미일  이달 들어 북한이 미사일을 반복해 발사한 것과 관련 이런 행동을 억지하기 위한 방책을 회담에서 논의하려 하고 있다 북한이 대륙간탄도미사일 ICBM 발사 재개를 시사한 것에 대한 대응책도 논의할 것으로 보인다 회담이 성사되면 정의용 외교부 장관 토니 블링컨 국무장관 하야시 요시마사 일본 외무상이 참석한다  외교장관 회담은 지난해  미국 뉴욕에서 열린 있는데 이번 회담이 열리면 지난해  취임한 하야시 외무상을 포함한 회동이 된다,국제,20220128,서울신문,한미일 외교 새달 회담 가능성.. 北미사일 논의
현대차가 한국차의 무덤으로 통하는 일본 시장에 전기자동차 EV 앞세워  만에 재도전한다 현대차의 일본 현지 법인인 현대모빌리티재팬은 다음달 중순 도쿄 지요다구에서 현대차 기자발표회를 연다고  밝혔다 현대차는 전용 전기차 아이오닉5와 수소차 넥쏘 친환경차를 앞세워 일본 시장 재진출을 발표할 것으로 보인다 이미 아이오닉5와 넥쏘 일본어판 홍보물을 제작하고 소셜네트워크서비스 SNS 통해 현지 마케팅을 펼치고 있다 지난  일본 법인명도 현대자동차재팬주식회사에서 영문인 Hyundai Mobility Japan 주식회사로 바꾸며 기업 이미지에도 변화를 줬다 일본시장은 수입차 비중이 넘지 못할 정도로 자국 차에 대한 충성도가 높다 특히 한국차를 낮춰 보는 시선도 많다 현대차는  일본 시장에 진출했지만  동안 판매량이   그치는 부진을 겪자  대부분의 사업을 정리했다 현재 버스와 같은 상업용 차량 판매를 중심으로만 일본 사업을 근근이 유지하고 있다 현대차는 전기차 전환기인 시점이 틈새를 비집고 들어갈 적기라고 보고 있다 하이브리드 판매에 집중했던 업계  도요타는 지난해 말에서야 뒤늦게 전기차 투자 방침을 밝혔을 만큼 준비가 미흡한 상태다 일본 정부가  내연기관 신차 판매를 금지하겠다며 친환경정책을 들고 나온 점도 현대차의 일본 재도전에 도움이 것으로 보인다 한편 현대차 기아는 지난해 미국에서  판매해 혼다  닛산 미쓰비시  제치고 글로벌  달성했다,국제,20220128,서울신문,한국차의 무덤 일본 .. 현대차 EV로 재도전
우크라이나를 둘러싼 미국 서방과 러시아의 강대강 대치 속에서 국무부가 러시아의  침공설을 제기했다 미국과 러시아 유럽과 러시아 대화 채널은 가동되고 있지만 어느 하나 간극을 좁히지 못하면서 전쟁 위기만 고조되는 형국이다 웬디 셔먼 국무부 부장관은  현지시간 싱크탱크 화상대담에서 블라디미르 푸틴 러시아 대통령이 우크라이나 사태와 관련한 최종 결정을 내렸는지는 모르겠다면서 하지만 우리는 그가 아마도 지금과  중순 사이에 군사력을 사용할 것이라는 모든 조짐을 분명히 보고 있다고 밝혔다 셔먼 부장관은 푸틴 대통령이 베이징동계올림픽 일정은 고려할 것으로 전망했다 그는 다음달  개막식에 푸틴 대통령이 참석할 것으로 예상된다는 우리 모두 안다면서 침공에 순간을 선택한다면 시진핑 중국 국가주석은 열광하지 않을 것으로 본다고 말했다 셔먼 부장관은 미국은 전면전을 비롯해 모든 종류의 시나리오에 대비하고 있다고도 했다 서방은 방위 태세를 강화하고 있다 나토 북대서양조약기구 공군 사령부에 따르면 영국에서 출발한 공군  소속 F15 전투기  에스토니아 공군기지에 배치됐다 앞서 리투아니아 공군기지에 배치된 덴마크 F16 전투기  벨기에 F16 전투기와 함께 발트해 상공 치안을 맡는다 캐나다는 우크라이나에서 우크라이나군 훈련을 돕고 있는 캐나다군 병력을 현재의  최대  늘려 나갈 예정이다 비살상 장비와 정보 공유 사이버 공격 대응 등도 지원한다 미국은 이날 러시아에 전달한 서면 답변을 통해 이번 사태의 핵심 사안인 러시아의 우크라이나 나토 가입 금지 요구를 사실상 거절했다 토니 블링컨 국무장관은 러시아가 선택할 있는 진지한 외교적 방법을 제시했다며 공은 러시아에 넘어갔다고 말했다 그러면서도 양국 외무장관 후속 회담을 기대한다고 밝혔다 이에 대해 블라디미르 자바로프 러시아 연방의회 외교위 제1부위원장은 리아노보스티통신에 안전보장에 대한 미국의 반응은 러시아를 만족시킬 없다 받아들일 없다고 말했다 앞서 러시아는 자국의 요구가 받아들여지지 않을 경우 심각한 결과가 초래될 것이라고 밝힌 있어 푸틴 대통령의 대응에 따라 우크라이나 위기가 새로운 국면으로 전개될 가능성이 있다 러시아 우크라이나 프랑스 독일 유럽  정상의 외교정책 보좌관들은 이날 프랑스 파리에서 가진 회담에서  민스크 협정에 따른 돈바스 전쟁 휴전 노력을 이어 가겠다는 공동 성명을 채택했다 프랑스 인사는 우리는 긍정적인 신호를 얻었다고 했지만 러시아 측은 우리 동료들이 우리의 주장을 이해해  안에 성과를 내길 희망한다고 말해 입장 차를 보였다  보좌관들은  내로 독일 베를린에서 추가 회담을 연다,국제,20220128,서울신문,"美국무부 ""러, 새달 중순 우크라 침공.. 전면전도 대비"""
일본 후쿠시마산 식품 수입에 반대하는 대만 제1야당 국민당 의원들이 입법원 국회 의장석을 점거했다  대만 자유시보에 따르면 국민당 소속 의원 수십명은 이날 입법원 의장석을 점거한  정부 예산안 심의를 거부하고 있다 대만 여야는 입법원  임시 회기 마지막 날인 이날까지 올해 예산안을 심의 의결하기로 합의한 상태였으나 국민당은 예산안이 확정되고 나면 정부가 후쿠시마산 식품 수입 허용을 발표할 예정이라면서 예산안 심의 거부에 나선 것이다 입법원  회기가 이대로 종료되면 예산안 통과가 미뤄지고 후쿠시마산 식품 수입 허용 결정 역시 춘제 연휴 이후로 미뤄질 가능성이 있다 다만 대만 정부와 여당에서는 이미 후쿠시마산 식품 수입 허용 방침을 정한 만큼 속전속결로 추진해야 한다는 기류가 강해 예산안 처리와는 별개로 수입 허용 고시를 가능성도 있다 대만은   일본 후쿠시마 원전 사고 이후 일대 농수산물 식품 수입을 금지해왔다 하지만 독립 성향의 차이잉원 총통이 이끄는 대만 정부는 대중국 경제 의존도를 낮추기 위한 차원에서 미국과의 자유무역협정 FTA 체결과 포괄적 점진적 환태평양경제동반자협정 CPTPP 가입을 희망하고 있다 대만은 지난해  CPTPP 가입을 신청했고 일본의 지지를 얻기 위해 노력하고 있으며 일본은 대만 측에 후쿠시마산 식품 수입 허용을 요청하고 있다 대만의 후쿠시마산 식품 허용 문제는 법령 개정 사안에 해당하지 않아 주무 부처인 위생복리부의 고시로 가능하다고 연합보는 전했다 대만이 후쿠시마산 식품 수입을 허용하기로 결정하면 향후 일본이 대만의 전례를 들어 CPTPP 가입을 희망하는 한국에도 같은 요구를 있다는 관측도 나온다,국제,20220129,서울신문,"""후쿠시마산 식품 반대"" 대만 국민당, 국회의장석 점거했지만.."
아이슬란드가 코로나19 방역 규제를 오는   단계적으로 모두 해제할 계획이라고  현지시간 발표했다 AFP 블룸버그통신 등에 따르면 카트린 야콥스도티르 아이슬란드 총리는 이날 기자회견에서 계획대로 진행된다면  중순까지 모든 규제를 해제할 있을 것이라고 밝혔다 야콥스도티르 총리는 오미크론 변이가 기존 코로나19 바이러스보다 치명적이고 백신 접종률이 양호하다는 등을 들며 일상 회복이라는 목표에 가까이 다가가고 있다고 덧붙였다 아이슬란드는 방역 규제 해제   모임 인원 제한 기준을   대폭 완화하고  금지했던 술집과 나이트클럽 영업을 식당과 마찬가지로 자정까지 허용한다 수영장 체육관 스키장 등의 최대 수용인원은 에서 확대한다 사회적 거리두기 규정은   축소된다 다음  적용하는  모임 인원을  허용하고 자가격리 규정을 폐지한다 수영장 체육관 스키장 등은 기능을 찾는다 정부는 성명에서 방역 규제 완화 과정에서 국내 감염자 수와 중증 환자가 일시적으로 증가해 사업장 운영에 차질이 빚어질 있다고 경고했다 정부는 새로운 바이러스 변종이 발견되지 않거나 의료 체계가 심각한 압박을 받지 않는다는 전제하에 오는   모든 국내 규제를 해제할 계획이다 전체 인구  아이슬란드에서는  이상 인구의 이상이  접종을 완료했고  이상 인구의 부스터샷 추가접종 맞았다 전날 신규 확진자 수는  기록했고 이날까지 누적 확진자 수는   누적 사망자 수는 ,국제,20220129,서울신문,"아이슬란드 ""3월 중순까지 코로나 방역규제 모두 해제"""
국내에서도 어린 자녀에게 무자비한 폭력을 행사한 젊은 부부에 관한 참담한 얘기가 끊이지 않는다 얼마 전에는 양부모에 의해 원룸에 방치됐던 초등학교    경찰서를 스스로 찾아가 양부모를 신고했는데 양엄마가 상처가 나지 않게 때린다고 증언한 일이 검찰의 기소로 이어졌다고 다시 화제가 됐다 그런데 영국의  부부가 생후  밖에 딸의 뼈를  넘게 부러뜨릴 정도로 잔인하게 학대한 혐의로 징역형을 선고 받았다고 야후 뉴스가  이하 현지시간 전했다 지난    런던 남부 사우스워크에 사는 벤자민 오셰 나오미 존슨 아미나페이 존슨이 숨을 쉬지 않는다며 응급 신고를 했다 응급요원이 최선을 다했지만 아미나에게 곧바로 사망 판정이 내려졌다 처음에는 사인을 유아 돌연사로 판단했다 아이의 외상이 전혀 눈에 띄지 않았기 때문이었다 그런데 부검 과정에 엑스레이를 찍어봤더니 태어나 되는 아이 몸에 무수한 폭행의 결과로 엉덩이의 뼈가  팔다리의 뼈가  부러진 사실이 확인됐다 어떤 골절은 최근 부상에 따른 것이었으며 다른 골절된 부위는 낫기 시작한 것이어서 수시로 구타 당한 것으로 보였다 소아과 전문의는 사고로는 이렇게 많은 뼈가 부러지기 어렵다는 결론을 내렸지만 부부는 끔찍한 부상이 잇따른 데다 제때 응급 처치를 받지 못해 생긴 것이라고 억지를 부렸다 런던 지방법원은  재판 끝에  아동 폭행과 학대  이하의 다른 자녀를 잔인하게 학대한 혐의에 유죄를 인정해 오셰에게   존슨에게   선고했다 니겔 피터스 판사는 부모가 자녀를 유린하거나 잔인하게 구는 사건이 또다시 발생해 슬프다면서 자녀를 잔인하게 대한 것에 관해 아주 높은 경각심을 표해야 한다는 의심의 여지가 없다고 판시했다 그는 겉으로 드러난 상처는 없었지만 전문가들이 무수한 뼈가 골절된 것을 확인하고 이것들이 사고로는 생기지 않으며 누군가의 위력이 가해져야만 생긴다는 것을 입증함으로써 부부의 끔찍한 죄상이 드러난 점이 특기할 만하다고 정리했다 번째 자녀에 대해 부부는 서로 주고받은 문자메시지를 통해 뺨을 때리고 제대로 돌보지 않은 사실을 인정했음이 법정에서 확인됐다,국제,20220129,서울신문,생후 8주 된 딸 뼈 60군데 부러뜨린 영국 20대 부부 징역 7~8년형
스텔스 오미크론 변이 BA 기존 오미크론 변이보다 증가율이 빠르다고 영국 영국 보건안전청 HSA 분석했다  현지시간 보건안전청은 지난  기준으로 잉글랜드에서 BA  확인됐다고 밝혔다  전에는 영국 내에는 스텔스 오미크론 변이 사례가 적지만 국내외에서 늘고 있다는 점을 들어 조사변이로 지정했다 스텔스 오미크론 변이는 오미크론 변이의 하위 변종인 스텔스 오미크론은 일부 특정 유전자 결함으로 인해 기존 PCR 유전자증폭 검사에서 다른 변이와 구별이 잘되지 않는 특징이 있다 보건안전청은 스텔스 오미크론 변이가 잉글랜드 모든 지역에서 오미크론 변이에 비해 증가율이 높다고 말했다 스텔스 오미크론 변이의 중증도에 관한 자료는 없지만 초기 분석에서 백신의 유증상 감염 차단 효과에선 오미크론 변이와 차이가 없었다고 강조했다 보건안전청에 따르면 지난해   올해   사이에 신종코로나바이러스 감염증 코로나19 중환자실에 입원한 경우는 대부분 델타 변이 감염 사례였다고 밝혔다 오미크론 변이가 우세종이 되면서 확진자가 급증했지만 오미크론 변이의 치명성은 낮아 입원은 그만큼 늘진 않았다 요양원에서도 오미크론 변이 감염 사례가 증가했지만 병원 입원까지 이어지진 않았다 영국 정부는 다음 달부터는 코로나19 고위험군 환자 수천명에게 화이자의 먹는 치료제 팍스로비드를 지급한다고 밝혔다 임상실험 결과에 따르면 증상이 나오고  이내 약을 먹으면 입원이나 사망 위험이 줄어든다 앞서  CNN은 미국 영국 스웨덴 덴마크 인도 싱가포르  스텔스 오미크론 변이 감염 사례가 보고됐다고 보도했다 일본 홍콩 필리핀 아시아 지역에서도 스텔스 오미크론 변이의 해외 유입 사례가 나왔다 덴마크 보건당국은 스텔스 오미크론 변이의 전염력이 기존 오미크론 변이의  달하는 것으로 추정하고 있다 변이 감염자들의 입원율은 차이가 없다는 분석도 나온다 질병통제예방센터 CDC 스텔스 오미크론 변이가 확산 중이지만 오미크론 변이보다 치명적이라는 증거는 발견되지 않았다고 밝혔다 테오도라 하치오아누 미국 록펠러대학 교수는 월스트리트저널 WSJ 에서 변이는 동일한 계통에서 동일한 시기에 발생했으며  돌연변이가 다르다고 말했다 이어 교수는 오미크론 변이와 비교해 스텔스 오미크론 변이의 스파이크 단백질에 약간의 차이가 있을 뿐이다라고 설명했다,국제,20220129,서울신문,"""오미크론보다 '전염력 1.5배' 빠르다..스텔스 오미크론 확산"""
미국 웨스트버지니아주의 저스티스 지사가 이런 망측한 짓을 벌였다 그것도 자신의 지사 연두교서를 발표하면서 이런 식으로 마무리했다니 어처구니 없다 저스티스 지사는  현지시간 텔레비전으로 생중계된 연두교서 발표 자리에서 민주당을 지지하는 것으로 유명한 팝스타 배우 베트 미들러 웨스트버지니아주 사람들을 가난하고 문맹이며 쇠약한 사람들이라고 힐난한 대해 분노를 표한 돌연 자신의 반려견 잉글리시 불독을 청중들에게 들어보이며 뒤로 돌린 다음과 같이 말했다고 비즈니스 인사이더가 다음날 보도했다 웨스트버지니아주는 보통 산악 주라고 불릴 정도로 낙후된 주란 이미지가 있는 것이엄연한 현실이긴 하다 그네들은 우리에 대해 세상에 대고 온갖 짖궂은 농담을 해대요 그래서 그런 관점에서 우리강아지가 베트 미들러와 그네들에게 전할 메시지가 있대요 XX나 핥아라 kiss her heinie 네요 heinie는 엉덩이를 의미하며 아울러 독일인과 독일 병정을 경멸하는 뜻도 갖고 있다 도널드 트럼프 재임 시절 민주당에서 공화당으로 당적을 옮겨 커다란 화제를 모았던 저스티스 주지사는 여러 차례 반려견을 주목받게 했다 백신 접종을 독려하기 위해 마스코트로 삼았다 백신 등록 사이트의 도메인 주소가 doitforbabydog wv gov였다 반려견은 주지사의 관저에서 공개 발표를 때마다 눈길을 붙들어맸다 주에서는 백신을 접종하면 총기를 경품으로 증정하는 캠페인을 펼쳐 미국에서도 가장 높은 백신 접종률을 자랑했다 하지만 이날 찰스턴에서의 연두교서 발표 현장에서의 퍼포먼스에 필적할 만한 일은 없었다 물론 미들러는 곧바로 트윗 글에 대해 사과했다 자신은 같은 민주당 출신인 바이든 대통령이 추진하는 사회복지 법안에 대해 웨스트버지니아주 출신의 맨친 상원의원이 건건이 방해하는 것에 화가 이런 상궤를 벗어난 트윗 글을 올리게 것이라고 해명했다 맨친 의원은 공화당이 영입해야 한다는 우스갯소리가 나올 정도로 바이든 정부의 법안 추진에 제동을 걸고 있다 원래 저스티스 지사의 연두교서 발표는 지난  예정돼 있었으나 코로나19 진단을 받는 바람에 미뤄져 이날 거행됐다 그는 당시 몸이 몹시 좋지만 백신을 접종한 덕분에 일어날 것이라고 고마움을 표시하기도 했다,국제,20220129,서울신문,"미 주지사가 반려견 들어보이며 ""베트 미들러, XX나 핥으라네요"""
