article,category,date,source,title
29일 현지시간 멕시코 할리스코주 라고스 모레노 인근의 고속도로에서 성지순례객을 태운 버스가 전복돼 최소  숨진 현장의 모습이 보인다,국제,20220131,뉴스1,성지 순례객 태우고 고속도서 뒤집어진 멕시코 버스
우크라이나를 둘러싼 미국 서방국과 러시아의 갈등 전쟁 발발 위기가 고조되고 있다 러시아 당국은 표면적으로는 전쟁 가능성을 부인하고 있지만 미국은 러시아가 이미 충분한 침공에 충분한 병력을 집결시켰다며  우크라이나를 침공할 있다고 전망했다 러시아가 실제 우크라이나를 침공하면  미국 테러로 촉발된  이라크 전쟁 이후  대규모 무력 충돌이 발생하게 된다 영국 일간지 가디언에 따르면 미국 기업연구소 AEI 러시아가 우크라이나를 침공하기 위해서는   명가량의 병력이 필요하다고 했다 이는  이라크 전쟁 당시 미군을 비롯한 연합군 병력인  감안한 것이다 그동안 우크라이나 국경에 집결한 러시아 병력은  명으로 추산돼 왔다 하지만 로이드 오스틴 국방장관은 지난  국방부에서 기자회견을 갖고 블라디미르 푸틴 대통령이 우크라이나에 대해 러시아 병력을 투입하기 위한 최종 결정을 내린 것은 아니지만 푸틴 대통령은 명백하게 그렇게 능력을 이제 갖췄다 말했다 에밀리 백악관 국가안보회의 대변인은 지난  바이든 대통령이 볼로디미르 젤렌스키 우크라이나 대통령과의 통화에서 러시아가  우크라이나를 침공할 가능성이 뚜렷하다 말했다고 밝혔다 가디언은 전문가들의 평가를 인용해 푸틴 러시아 대통령이 전면적 공격을 선택할 가능성은 가장 낮다고 평가했다 침략 전쟁에 대한 국제 사회의 비난과 제재뿐 아니라 침략 전쟁에 뒤따를 우크라이나 저항 등은 해결하기 쉽지 않다는 것이다  미군의 이라크 주둔 이후 보고서를 공동집필한 AEI의 프레드 케이건 선임연구원은 러시아의 진정한 도전은 우크라이나 수도 키예프를 점령한 이후 반란이 발생했을 이를 통제할 있느냐에 달렸다고 지적했다 케이건이 다른 전문가들과 작성한 논문에 따르면 주민  한명의 반란 진압군이 필요하다 러시아가 키예프와 우크라이나 동부 주요 도시 점령을 위해서는  병력이 필요하다고 가디언은 설명했다 국제전략문제연구소 IISS 우크라이나 병력은   돈바스 지역에서 시작된 저강도 분쟁에 참전한 베테랑이  명에 이른다고 했다 우크라이나 시민  무장투쟁을 벌일 의시가 있다고 밝혔다 만약 러시아가 실제 침공을 감행한다면 우크라이나 병력과  명에 달하는 예비 전력들의 산발적 게릴라전 등에 직면할 수도 있는 셈이다 월스트리트저널 WSJ 지난  동안 우크라이나 군사력이 증강됐지만 러시아군에는 미치지 못한다고 했다 다만 분쟁이 발생하면 러시아군도 상당한 피해를 입을 것이라고 보도했다 우크라이나 군은 그동안 서방으로부터 훈련을 받고 기갑장비를 업그레이드했으며 미국과 영국 대전차미사일과 터키산 드론으로 무장하고 있다 같은 문제에도 러시아는 로켓과 공군력 등에서 압도적 이점을 가지고 있다 이스칸데르 탄도미사일 등으로 우크라이나 병력을 초토화할 있다 러시아의 이런 압도적 무력은 우크라이나 사기를 떨어뜨려 수백만 명을 달아나게 수도 있다 문제는 이런 첨단 무기를 앞세워 러시아가 침공하면 민간인 사상자 발생은 불가피며 이는 국제사회에도 영향을 수밖에 없다 이는  크림반도 병합 등과는 다른 문제다 앞서 우크라이나에서  분쟁 감시인으로 활동한 IISS의 사미르 퓨리 선임연구원은 공군력을 사용하지 않는 전면 침공은 상상하기 어렵다 러시아가 넘기에 문지방은 그만큼 높다 지적했다 러시아가 우크라이나 수도 키예프를 점령하는 것마저도 쉽지 않다는 전망이다 푸틴 대통령은 우크라이나를 침공하려면 인구  키예프와  북동 하르키프 등을 어떻게 다룰지 결정해야 한다 이와 관련 케이건 연구원은 푸틴 대통령은 시리아 내전 당시 시가전은 매우 어려우며 러시아는 시리아 알레포에서 어려움을 겪었다고 말한 있다고 했다 독일 빌트신문은 러시아는 하르키프를 포위하고 궁극적으로 키예프에 대한 보급을 차단하는 중세방식을 희망하고 있다고 했다 하지만 서방 분석가들은 키예프에 있는 대통령 주요 요충지는 방어하기 쉬운 드네프르강 서쪽에 있다며 러시아의 키예프 포위는 쉽지 않을 것이라고 전망했다 러시아로서는 드네프르강을 넘는 가장 쉬운 방법은 북쪽에 있는 벨라루스를 지나는 것이다 이를 위해서는 벨라루스의 도움이 필수적이지만 최근 양국은 합동 군사훈련을 하는 돈독한 관계를 과시하고 있어 문제가 없을 것이라는 전망이다 이와 관련 케이건 연구원은 러시아의 기계화 부대가 벨라루스에 배치될 경우 러시아가 행동할 준비가 됐다는 것을 알리는 중요한 징후가 것이라고 했다 러시아로서는 침공하지 않더라도 벨라루스에 상주군을 주둔시키는 것이 유리하다고 했다 러시아 주둔군이 우크라이나뿐 아니라 발트해 국가에도 잠재적인 위협이 있기 때문이다 영국의 싱크탱크 헨리 잭슨 소사이어티의 타라스 쿠지오 박사는 푸틴 대통령이 전면전을 선택하기 어려울 것이라고 전망하며 다른  대안이 있을 것이라고 전망했다 번째는 친러 성향의 돈바스 지역을 점령 합병한다는 시나리오다 다른 시나리오는 이미 합병된 크림반도와 같이 접경지역 영토를 확장하는 것으로 동부의 산업도시 마리우폴을 점령하는 것이다 러시아로서는 주요 산업 현장을 점령 우크라이나의 군사력을 약화시킬 있다는 것이다 다른 선택지로는 크림반도 인근 흑해 연안 항구인 오데사 드네프로 페트로프스크 점령 시나리오가 나오고 있다 쿠지오 박사는 인구  오데사를 점령하기 위해서는 크림반도를 통한 해상 작전이 필요할 것이라고 했다 뉴욕타임스 NYT 러시아가 가상전 virtual warfare 나설 가능성이 있다고 보도했다 러시아 해커들은 앞서  이미 우크라이나 전력망 공격에 성공한 적이 있다 지난  마이크로소프트 MS 우크라이나 정부와 민간 전산망에서 수십 개의 파괴력 높은 악성 코드가 발견됐다고 밝혔다 MS는 지난  우크라이나의 모든 정부기관 비영리 정보기술 기관에 걸쳐 있는 악성코드가 발견됐다 밝혔는데 거의 동시에 우크라이나 정부 기관도 웹사이트가 훼손됐다고 밝힌 있다 제이크 설리번 백악관 국가안보보좌관도 CBS에 출연해 러시아가 과거 우크라이나 전력망과 정부부처 기업 등에 사이버공격을 감행한 이력을 들어 우리는 달간 러시아가 우크라이나에서 긴장을 고조시키기 위해 공공 민간 부문에 사이버공격을 가할 있다는 점을 경고해왔다 말했다 우크라이나 당국도 처음에는 이번 정부 웹사이트 공격 배후로 벨라루스 해커들을 의심하기도 했지만 이내 러시아 소행으로 입장을 정했다 국토안보부가는 러시아가 미국과 나토에 대한 대응으로 사이버공격을 수도 있다고 밝혔다,국제,20220131,뉴스1,"러, 우크라 침략시 '전면전' 보단 '국지전' '사이버전' 택할듯"
미국 연준의 기준금리 인상이 임박하자 기술주 투매현상이 나오고 있는 가운데 투자 테마가 기술주에서 가치주로 옮겨가고 있다 이런 가운데 전세계  부호의 재산이 주는데 비해 유명한 가치투자자인 워런 버핏 버크셔 헤더웨이 회장의 재산은 것으로 나타났다 세계  부호는 대부분 기술기업 창업자들이다  블룸버그 억만장자 지수에 따르면 세계  부호들의 개인 재산은 들어  달러 줄어든  달러로 집계됐다 재산이 가장 많이 줄어든 사람은 세계 최고 갑부인 일론 머스크 테슬라 최고경영자 CEO 그의 재산은  달러로 연초보다  달러 감소했다 특히 지난  하루에만  달러가 줄었다 머스크가 공급망 문제가 지속돼 올해 신차를 출시하지 않는다고 밝혀 당일 테슬라의 주가가 넘게 하락했다 세계  부호 올해 재산이 늘어난 사람은 워런 버핏 사람뿐이었다 버핏의 재산은  달러로  달러 증가했다 그는 마크 저커버그 페이스북 CEO를  달러 차이로 제치고  올라섰다 저커버그는 자산이  달러 감소했다 버핏은 가치 투자 유명하다 버핏의 버크셔 해서웨이는 증시의 전반적인 하락 속에서도 주가가 연초 대비 올랐다 특히 버핏은 기줄주 가치주라고 있는 애플의 주가가 급등해 하루새 재산이  달러 불기도 했다 지난  사상최고의 분기실적을 달성한 애플의 주가가 가까이 급등하자 애플에 투자하고 있는 워런 버핏의 재산이 하루새  달러  늘었다 가치주 투자자로 유명한 버핏은 기술주를 보유하지 않으나 애플은 예외다 그는 애플 전체 주식 보유하고 있다 기술주 시대가 저물고 가치주 시대가 시작됨을 보여주는 삽화 라고 전문가들은 입을 모으고 있다,국제,20220131,뉴스1,기술주 급락으로 세계 10대 부호 재산 주는데 버핏만 증가
카라카스 AP  현지시간 베네수엘라 카라카스의 호텔 내에 설치된 코로나19 백신 접종소에서 여성이 스푸트니크 백신  접종을 하고 있다 01 26,국제,20220126,뉴시스,스푸트니크 3차 접종하는 베에수엘라 고령 여성
월가 증시가 새해 들어 곤두박질을 치고 있다 연방준비기금 FED 물가상승을 막기 위해 강력하게 돈줄을 것이라는 예상 때문에  연속 하락하고 있다 이에 따라 시장의 공포를 반영하는 CBOE변동성지수가 가까이 상승했다 와중에 지난  다우 존스 지수가  빠졌다가 상승세로 마감하는 극심한 시장 변동 상황이 벌어지고 있다 이처럼 정신 차리기 힘든 상황이지만 변동성이 커지면서 저가 구매 기회가 생길 수도 있다면서 변동성이 시장의 건전한 모습을 보여주는 것이라는 의견을 내놓는 전문가들도 있다 워싱턴포스트 WP  현지시간 증시 상황에 대해 투자자들이 저가 구매 시점인지 아니면 하락할 것인 지를 판단해야할 시점 이라는 AJ 벨사 투자책임자 루스 몰드의 발언을 인용하면서 증시 전망을 점검하는 기사를 내보냈다 기사에서 WP는 불확실성 금융정책 경제 통계 기업 수익률 지정학적 요인 등을 고려해야 한다고 강조하고 각각에 대해 분석했다 불확실성 월가는 긴장이 해소되지 않을 경우 갈팡질팡한다 긴장의 강도가 경우 그렇다 팬데믹 초기의 폭락이나 정책 결정을 시점의 하락이 좋은 예다 투기적 거래가 늘어나는 것이다 미션스퀘어 리타이어먼트사 수석 투자 책임자 웨인 위커는 시장은 불확실성을 싫어한다 높은 금리 높은 물가 소득 증가율 저하 등으로 현재 변동성이 커진 상황 이라고 말했다 불안감 때문에 등락이 생긴다 팬데믹 초기 투자자들이 새로운 현실에 적응하는 과정에서도 그랬다 팬데믹으로 공급망 혼란 새로운 코로나 변이의 출현 경제 예측이 힘들어졌지만 전례없는 일들이 일상이 되면서 패닉 반응은 완화됐고 기업들도 양호한 이익을 내고 있다 LPL 파이낸셜의 주식투자 전략가 제프 부치바인더는 투자자들이 최근 동안 꾸준한 폭의 상승에 익숙해짐에 따라 최근의 변동에 부담을 느낀다 말했다 그는 현재의 변동성이 과거의 변동성에 미치지 못한다고 덧붙였다  매년 이상 세차례 떨어졌다가 차례 회복하는 일을 반복했다 이는 최근 최고치보다 하락할 있음을 뜻한다 부치바인터는  미만으로 하락했던 지수가   최저점의 두배 이상으로 뛰었다 올해는 변동성이 커질 이라고 말했다 금융정책 변화 최근 증시 변동성은 연준이 물가상승을 억제하려는 것과 관련이 크다 휘발유가격과 식료품가격 상승은 금리를 올리면 완화될 있다 그러나 금리 인상은 경제를 위축시키는 양날의 칼이어서 주식 시장에 타격을 주는 일이 많다 주가가 높은 회사들이 표적이 된다 연준은 오미크론이 경제를 악화시키는 것과 꾸준히 상승하는 소비자 물가 임금상승 사이에서 줄타기를 하고 있다 뉴욕 라이프 인베스트먼트 선임국장 로렌 굿윈이 밝혔다 연준의 경기부양 축소 전환은 물가가 디플레이션에 빠져 경제가 타격을 입는 것을 막으려 노력해온  동안의 정책을 뒤집는 것이다 연준이 제로에 가까운 금리를 인상하고 팬데믹으로 불투명해진 경제 전망이 방향성을 보임에 따라 투자자들은 보유 자산을 재평가해야 한다 채권평가기관 KBRA의 수석 전략가 헤서는 경제정책 전환을 감속 great deceleration 이라고 표현했다 그는 경제가 올해 장기 잠재 성장률 이상으로 성장할 것으로 예상하면서도 연준이 금리를 인상한  시기  경기침체로 이어졌음을 지적했다 그는 사람들이 경기 후퇴를 예상하고 있다 말했다 반면 뉴에이지 알파의 수석 투자책임자 줄리언 코스키는 높은 금리가 향후 주가에 과도하게 악영향을 것으로 예상할 필요는 없다고 말했다 그는 연준 정책과 주가 사이 직접적인 연관성은 없다 주가 움직임은 훨씬 복잡해 한가지 원인에만 좌우되지 않는다 면서 투자자들이 연준이 어떤 정책을 펼지보다 개별 종목의 성장성이 주가에 얼마나 반영돼 있는지에 주목하도록 권한다 말했다 경제통계 투자자들은 세계경제의 건전성을 파악하기 위해 온갖 경제통계에 목을 맨다 세계경제가 개별 회사 주가의 최저치에 영향을 미치기 때문이다 각국의 고용 기업 생산성 소비자 신뢰도 국내총생산 GDP 도매물가 경제성장률은 매일 주가에 영향을 미친다 투자자들이 이들 데이터를 반영해 장기 전망을 하기 때문이다 올들어 현재까지 가장 중요한 요인은 물가가  최고치로 올랐으며 노동력 부족이 심하다는 점이다 노동자들의 이직률이 최고치에 달하며 채우지 못한 일자리가  달한다 감염률 사망률 입원률 코로나 관련 통계도 투자자들이 경제활동 축소 교통이용 감소 생산성 저하 팬데믹이 경제에 미치는 영향을 평가하는데 반영한다 밀러 앤드 워싱턴의 마이클 CEO는 경제는 불확실성과 불균형의 혼란 속에서도 근본적으로 건전하다 말했다 그는 소비 심리가 건전하며 경제가 확장하고 있고 고용률도 높다 면서도 물가 상승과 노동력 부족 공급망 혼란 팬데믹 지속이 걱정스러운 요인 이라고 밝혔다 그는 차분하게 장기전망에 집중할 것을 권했다 기업의 수익성 기업 이익이 주가에 가장 영향을 미친다 양호한 분기 실적을 기업에 대한 관심이 커지면서 주가가 뛰어 오른다 그러나 반대로 투자자 신뢰를 잃는 경우 투매가 일어날 수도 있다 팬데믹 시작 직후 주가가 폭락한 투자자 신뢰가 회복하는데는 개별 기업의 수익성이 좋기 때문이었으며 지난해 주식시장이 역대 최고의 활황을 보였다 최근  동안 지수 포함 기업들의 실질 이익이 예상치보다 뛰어 넘었다 지수는 지난해 하반기 연률 이상 성장할 것으로 예상되지만 기업들이 이익을 환경 관련 투자에 돌리는 등으로 높은 성장을 지속하기는 힘들 전망이다 투자자들은 애플 테슬라 마이크로소프트 대기업들의 이익이 늘어날 것을 기대하고 있다 GE는 이익이 예상치보다 많았지만 주가는  이상 하락했다 투자자들이 공급망 혼란으로 지난 분기   손실을 것에 실망했기 때문이다 지정학적 요인 세계적 영향이 갈등이 투자 리스크 원인이 된다 경제 불확실성을 높이기 때문이다 오미크론 확산이 국제 여행 경제 전반의 건전성에 악영향을 미치고 있다 감염 확산으로 기업들의 구인난이 심해지고 있다 최근 투자자들은 러시아의 우크라이나 침공 가능성을 우려하고 있으며 중동에서 반복된 미사일 공격도 에너지 시장을 출렁이게 했다 정부는  러시아가 제재에 맞서 석유와 천연가스 공급을 차단할 경우에 대비해 유럽 동맹국들에 대한 에너지 공급을 보장하기 위해 노력하고 있다고 밝혔다 CBOE 원유 변동성지수가 올해 긴장 고조로 인해 역대 최고치에 달했다 유가도 지속적으로 상승해 브렌트유와 서부텍사스 중질유가  상승했다,국제,20220126,뉴시스,"올들어 곤두박질 치는 미 증시, 저가 매입 기회 될까"
지난해 중국 재정수입 세입  위안  으로 사상 처음  위안을 돌파했다고 신화망 신랑망 등이  보도했다 매체에 따르면 재정부 쉬훙차이 부부장은 전날 신문판공실 주관 기자회견에서 참석해  재정수입이 전년 대비 늘어났다고 밝혔다 쉬훙차이 부부장은 작년 재정수입 증대율이  국내총생산 GDP 성장률 목표치 이상을 훨씬 웃돌았다고 설명했다 지난 한해 동안 세금과 수수료를  위안 이상 경감했지만 GDP의 착실한 성장이 세입 증가로 이어졌다고 쉬훙차이 부부장은 설명했다 경기 회복세가 지속하고 산업 생산자 공장출하 가격지수가 상승한데 힘입어 연간 재정수입이 연초 예상을 상회했고 중앙과 지방 모두 상당한 초과 세입이 있었다  재정지출 세출  많은  위안에 달했다 쉬훙차이 부부장은  재정에 관해선 경제 상황과 불확실 요인을 고려 분석해 예산안을 책정하겠다고 표명했다 그는 자세히 언급하지는 않았지만 최근 코로나19 확산에 대한 우려가 있다며 이를 올해 예산안에 반영할 방침을 내비쳤다 쉬훙차이 부부장은 올해 지방채 연간 한도에 대해 합리적인 수준으로 설정한다며 건설 중인 프로젝트와 대형 사업에 중점을 두고 채무 리스크를 피하면서 인프라 투자를 촉진하겠다고 언명했다 아울러 쉬훙차이 부부장은 경기하방 압력에 대응하기 위해 새해에는 더욱 대규모로 감세와 수수료 인하 조치를 시행한다고 덧붙였다 감세와 수수료 인하를 확대해 제조업의 질적 성장과 중소 중견기업 자영업자의 어려움을 해소하는데 초점을 맞추겠다고 한다 지방정부의 재정부담을 덜어주고자 중앙에서 지방으로 재정 이전을 확대할 계획이라고 쉬훙차이 부부장은 부연했다,국제,20220126,뉴시스,[올댓차이나] 2021년 중국 재정수입 20조 위안 첫 돌파..10.7%↑
미국과 유럽연합 EU 러시아가 우크라이나를 침공할 경우 러시아 은행들을 무력화하는 것을 목표로 금융 제재 합의에 가까워지고 있다고 영국 일간 파이낸셜타임스 FT  현지시간 보도했다 관리들은 이날 오전 기자들과 전화브리핑에서 행정부 관위 관리들은 재앙적 수준의 경제적 결과를 가져올 것이라는 위협이 블라디미르 푸틴 러시아 대통령의 우크라이나 침공을 막을 있기를 여전히 희망하고 있다고 말했다 바이든 행정부 고위 관리는 푸틴이 경제적 고통에 대한 그의 내성은 다른 지도자들보다 높을 있지만 그의 계산에 영향을 있다고 생각하는 고통의 한계값은 있다고 우리는 생각한다 밝혔다 미국과 EU 관리들은 우크라이나 침공을 강행할 경우 러시아에 부과할 징벌적 조치와 관련해 연합전선을 구축하려고 노력하고 있다 그러면서 미국은 EU를 결집시키고 있다 EU 관리는 이날 제재를 위한 방아쇠 무엇인지에 대해 절대적인 명확성을 확보하기 위해서는 뒤에서 많은 작업 해야 필요가 있다고 말했다 러시아에 대한 제재의 성격과 규모에 대해 보다 구체적인 작업이 이뤄져야 한다는 것이다 이와 관련 바이든 행정부 관리들은 대러 제재와 관련해 동맹국들 사이에서 정말 고무적인 수렴 합의 있었다고 강조했다 특히 금융제재와 관련해서 더욱 그렇다고 FT는 전했다 관리는 미국과 EU간 공감대가 형성되고 있는 부분은 제재를 가할 금융기관 국유기업의 규모 조치의 심각성 시급성 맞춰져 있다면서 금지 제재 새로운 자금 조달 흐름과 함께 기존 위험 자산에 영향을 미치는 정도가 이라고 전했다 이와 관련 백악관은 러시아 스베르뱅크 VTB 가즈프롬 러시아가 직접 투자한 펀드를 포함해 러시아 금융기관에 제재를 가하려는 의회의 노력을 공개적으로 지지한 있다 문제는 제재 시기다 이와 관련 정치전문매체 폴리티코는 이날 제재가 언제 가능할지에 대한 합의가 없기 때문에 러시아에 얼마나 빠르고 강력하게 대응할 것인지 불확실하다 지적했다 EU 고위 관리는 이제 제재를 촉발하는 상당한 노력이 필요하다 이는 다양한 전쟁 시나리오를 다룰 특히 중요하다 말했다 러시아가 사이버 전쟁을 벌이거나 아니면 전면전을 하는 다양한 시나리오에 따라 제재 방식과 시기가 달라질 있다는 것으로 풀이된다 제재 시기는 지난  벨기에 브뤼셀에서 열린 EU 외무장관 회의에서도 논의했지만 합의하지 못했다고 한다 바이든 대통령이 EU 수장들과 함께 화상회의에서도 이에 대한 명확한 합의는 없었다고 폴리티코는 보도했다,국제,20220126,뉴시스,"""미-EU, 대러 금융제재 합의에 가까워져""..시기는 아직 논의중"
