article,category,date,source,title
조 바이든 행정부는  현지 시각  이상 민간 기업 직원들에 코로나 백신 접종 의무화 조처를 공식 철회했다 이는 연방대법원이 지난  직업안전보건청 OSHA 지난해   이상 민간 사업장 직원들의 백신 접종을 의무화한 조치가 과도한 권한 행사라고 판단한 따른 것이다 노동부 산하 직업안전보건청 OSHA 이날 관보를 통해 철회 방침을 밝히면서도 노동자들이 직장에서 코로나 바이러스가 만든 계속된 위험에 대항하기 위해 접종할 것을 강력히 권장한다고 했다 작년  바이든 행정부는  이상 민간 사업장 종사자에게 백신 접종을 의무화하고 접종받지 않을 경우 마스크를 착용하고 정기적으로 코로나 검사를 받도록 했다 이를 지키지 않으면 사업주가 과태료를 물도록 했다 이는 미국에서 백신 접종 거부자가 많아 접종률이 정체 상태를 보이자 바이든 행정부가 강행한 조치였다 하지만 연방 대법원은 지난  대법관 의견으로 OSHA의 조처가 연방 정부의 법적 권한을 넘어선 것이라는 이유를 들어 무효로 했다 당시 바이든 대통령은 즉각 성명을 내고 의료 종사자 백신 접종 의무화는 사람들의 생명을 살릴 것이라면서 대법원의 이번 판단은 실망스럽다고 했었다 바이든 행정부는 이날 의무화 조처 철회를 알리면서 의무화에 반대해 법원에 제기된 다른 소송들을 각하해 달라는 내용의 신청서를 법원에 제출했다 바이든 행정부는 연방 정부의 공무원과 하청업체 직원들에게도 백신 접종을 의무화했지만 조처 역시 연방 법원들이 제동을 거는 판결을 내리고 있다 다만 바이든 행정부가 병원 요양원 의료 기관 종사자를 상대로 내린 의무화 조처에 대해선 연방 대법원이 필요성을 인정해 유효한 상황이다 로이터 통신은 법원이 연방 당국의 권한 부족을 이유로 의무화를 무효로 했지만 기업이나 정부,국제,20220126,조선일보,"바이든 행정부, 민간 기업 '백신 의무화' 결국 철회 조치"
중국 정부가 미얀마 반정부 민주 진영에 중국이 투자한 공장에 대한 공격을 중단해달라고 요청했다고 현지 매체가 보도했다 미얀마 양곤에 주재한 중국 대사관은 최근 미얀마 군부 정권에 대항하는 민주진영 임시정부인 국민통합정부 NUG 측에 중국 정부가 투자한 니켈 공장에 대한 공격을 삼가달라고 요청했다고 현지 매체 이라와디가  보도했다 지난  민주진영 시민방위군 PDF 시가잉 지역 따자잉구에 있는 철탑  폭파했는데 철탑은 중국 국영 광산기업이 미얀마 광산 기업과 합작해 설립한 타가웅 타웅 니켈 공장에 전력을 공급하고 있었다 니켈 공장은 중국이  달러  투자해 연간  페로니켈 니켈 철의 합금 생산하는 미얀마 최대 규모 공장이다 현지 민주화 활동가들은 중국 국영 기업이 미얀마에서 운영하는  니켈 광산 공장이 미얀마 군부 정권에 자금을 지원한다며 폐쇄를 요구하고 있다 시민단체 추산에 따르면  회계연도에만   달러  중국 자금이 니켈 광산을 통해 미얀마 군부로 흘러들어 갔다고 이라와디는 전했다 국민통합정부 국방장관은 이웃 국가들의 투자 자산을 공격하는 것은 국민통합정부의 방침이 아니다라면서 타가웅 니켈 공장의 경우 지역 미얀마군이 공장을 근거지로 시민들을 공격하는 경우가 있어서 지역 시민방위군이 반격에 나선 것이라고 설명했다 그는 중국 측에 향후 이와 같은 일이 발생하지 않을 것이라 약속하면서도 외국 기업들이 군부 정권과 거리를 둬야 한다고 했다,국제,20220126,조선일보,"중국, 미얀마 민주화 진영에 ""중국 투자 공장 공격 중단해달라"""
일본에서 사상 처음으로 하루 신종 코로나 바이러스 하루 확진자가  넘어섰다  NHK에 따르면 이날 오후   일본 전역에선  새로 코로나 확진 판정을 받았다 하루 코로나 감염자가  돌파한 이번이 처음이다 지난  신규 확진자  돌파한 사흘만이다 이날 코로나로 사망한 사람 역시 전국  집계됐다 지역별로는 도쿄도에서  오사카부에서  새로 확진 됐다 도쿄와 오사카 확진자 모두 사상 최다치다 이어 가나가와현  아이치현  후쿠오카현  효고현  지바현  사이타마현  등의 순으로 확진자가 많았다 일본의 폭발적인 코로나 확산세는 오미크론 변이가 주도하고 있다 특히 도쿄도의 경우 지난  일주일  상대로 실시한 검사 결과 확진자 오미크론 변이로 의심되는 것으로 파악됐다 도쿄도 담당자는 델타 변이가 오미크론 변이로 거의 대체된 것으로 보인다고 NHK에 말했다 일본 정부는 이날 긴급 방역 조치에 해당하는 만연 방지 중점 조치를 홋카이도  광역자치단체에 추가로 적용하기로 결정했다 이로써 만연 방지 중점 조치가 적용되는 지역은 전국   됐다 기한은 이달  다음달 ,국제,20220126,조선일보,日 신규확진자 첫 6만명대..도쿄 감염자 99%는 오미크론 의심
미국 대학 입학능력 시험 SAT를 이상 펜은 필요 없게 됐다 앞으로는 SAT와 한국의 수능 모의고사 격인 PAST 모두 디지털로 형식으로 바뀐다 SAT를 주관하는 칼리지보드가  현지 시각 같은 내용을 발표했다고 월스트리트저널 WSJ 등이 보도했다 해외 응시생은 당장 내년부터 미국 학생은  적용된다 시험은 감독관 통제 아래 학교나 지정된 시험장에서 치러진다 각자 자신의 노트북 태블릿PC를 이용해 시험을 있고 주최 측에서 빌려주는 컴퓨터도 사용 가능하다 시험도 쉬워진다고 칼리지보드 측은 밝혔다 시험 시간이 기존   줄었다 지문이 짧아지고 지문 개의 문제만 나온다 수학 문제도 장황해진다 만점은 기존과 같이  시험 결과도 며칠 안에 나와 종전에 주가 걸렸던 것에 비해 빨라졌다 프리실라 로드리게스 칼리지보드 부회장은 디지털 SAT는 치르기 편할 뿐만 아니라 더욱 적합한 시험이 것이라고 말했다 작년 SAT에  이상 응시한 학생수는    급감했다 신종 코로나바이러스 감염증 확산으로 시험장이 폐쇄되면서 시험 성적 제출을 의무화 하지 않는 대학이 늘었고 시험이 부유층 백인에게 유리하다는 비판이 꾸준히 제기됐다 미국의 교육 시민단체에 따르면 올해 가을학기 입시에서 SAT 시험 성적이 필수가 아닌 대학은 달했다 하버드 대학을 포함 다수 대학들은 SAT 시험 성적보다 고교 시절 전반적인 학업성취도,국제,20220126,조선일보,"美 대입시험 SAT, 내년 디지털로 전환..더 짧고, 쉬워진다"
덴마크가 신종 코로나바이러스 관련 질병 위험 단계를 낮추고 관련된 제한 조치를 해제할 예정이라는 보도가 나왔다 메테 프레데릭센 덴마크 총리가  현지 시각 오후 정부 브리핑에서 코로나 방역 규제 해제안을 발표 예정이라고 현지 일간 윌란스-포스텐 Jyllands-Posten 등이 익명의 소식통을 인용해 보도했다 이달  시행되는 현재 방역 규제 조치를 연장하지 않겠다는 의미다 다만 입국 코로나 검사를 받고  자가격리를 해야 하는 여행 관련 규제는  연장될 가능성이 높다고 매체는 전했다 덴마크 정부는 보도에 대해 아직 확정된 없다고 밝혔다 윌란스 포스텐에 따르면 같은 방안은 전염병 자문위원회의 전문가들이 권고 했다 이들은 코로나를 사회 중대 위협 질병으로 분류한 것도 해제할 것을 권고 했다 코로나 위험 단계를 낮추면 질병 대응 방식 전반이 달라지기 때문에 중요하다 현지 일간 폴리티켄 Politiken 정부의 해제안이 지난  확진자가 가장 많은 상황에서 나왔다고 보도했다 그러면서 전문가들이 지금은 새로운 전염병 시대다 전염성 높고 감염자가 늘고 있지만 과거처럼 병원에 입원해야 정도로 심각하지 않다고 권고 했다고 전했다 덴마크는 앞서 작년  초에도 확진자가 줄고 백신 접종률이 높아지자 제일 먼저 코로나 관련 규제를 모두 해제했다 그러나 이후 확진자가 급증하자 같은해  방역조치를 연달아 재도입하고 강화했다 이달 들어 코로나 중환자가 꾸준히 줄자 지난  영화관 극장 박물관 등이 다시 문을 열도록 했지만 식당 영업시간 제한,국제,20220126,조선일보,"중환자 줄어든 덴마크, 코로나 방역 규제 없앤다"
미얀마 군정이 가상사설망 VPN 이용해 금지된 사이트에 접속할 경우 징역형에 처하는 사이버보안법 제정을 추진 중이다 VPN은 인터넷 접속 서버를 우회해 국가에서 금지한 온라인 사이트에도 접속할 있게 돕는 기술이다 현지 매체 이라와디는  현지 시각 군정 통신부가 부처와 인터넷 사업자 은행 등에 같은 내용의 법안을 첨부한 공문을 보냈다고 보도했다 법안은 VPN을 이용해 금지 사이트에 접속할 경우 징역   선고 있다고 명시했다 외에 인터넷 서비스 제공자들은 정부 당국이 요청할 경우 이름 주소 과거 접속 기록 등이 담긴 개인 정보를 제공해야 한다는 내용도 담겼다 통신부는 오는  의견을 내라고 보내면서 법령이 시행돼야 한다는 결론을 이미 내렸다고 공문에 언급했다 미얀마에 군부는 작년  쿠데타를 통해 정권을 잡은 페이스북 트위터 인스타그램 사회관계망서비스 SNS 접속을 차단했다 SNS를 통해 반군부 관련 활동이 공유되고 반군부 저항 단체들을 위한 모금 활동 등도 진행됐기 때문이다 그러나 대다수 국민은 VPN을 통해 SNS 차단 조치를 피해왔다 해외에 상황을 알리고 시위를 계획하는 것도 모두 SNS를 통해 이뤄졌다,국제,20220126,조선일보,미얀마에선 VPN 사용하면 감옥행?.. 반군부 SNS 활동 막으려 안간힘
지난해 발견된 임신부 미라에 있던 다른 미라의 비밀이 밝혀졌다 인공적으로 만들어진 미라와 달리 자궁에 있던  태아 미라는 자연적인 과정을 거쳐 미라가 됐다 지난  미국 과학매체 사이언스알러트에 따르면 폴란드 바르샤바대학 연구팀은 지난해 임산부 미라의 자궁에서 발견된  태아로 추정되는 미라가 수분이 빠져나가는 과정 등을 거치며 자연적으로 만들어졌다는 연구 결과를 발표했다 별도 시신 처리를 통해 미라가 어머니와 달리 태아는 자연 미라가 것이다 연구 결과를 보면 태아가 있던 자궁은 어머니가 사망하면서 혈액의 pH 물질의 산성 정도를 나타내는 수치 떨어져 산성화됐다 여기에 암모니아 포름산 등의 농도가 짙어졌고 자궁에 밀봉된 태아는 산소의 접근이 거의 완벽하게 차단되며 썩지 않고 미라가 것으로 보인다 연구팀은 피클이 만들어지는 과정과 비슷하다며 어머니와 태아는 다른 방식으로 미라가 것이라고 했다 일반적으로 임신  정도면 태아의 성별을 확인할 있지만 미라는 불가능했다 연골 등은 모두 사라진 상태이기 때문이다 미라는 지난해  연구팀이 폴란드 바르샤바 국립박물관에서 발견했다 당시 미라는 남자 성직자의 시신으로 알려졌지만 엑스레이 등을 통해  사망한 임산부 미라라는 사실이 새롭게 드러났다 연구팀은 임산부의 생전 나이를  추정했고 태아의 두개골 크기 등으로 미루어 임신  봤다 다만 자궁이 그대로 남겨진 것에 관해서는 여전히 미스터리다 고대 이집트인은 내세에 관한 믿음으로 시신의 장기를 꺼내 방부 처리를 하고 뒤에 다른 곳에 보관한다 임산부 미라도 마찬가지로 대부분 장기는 다른  자루에서 발견됐지만,국제,20220126,조선일보,2000년전 사망한 어머니 따라..자연적으로 미라 된 '28주 태아'
미국 정부가  현지 시각 유럽에 에너지 공급이 충분하도록 하기 위해 중동 북아프리카 아시아 등의 가스 원유 생산업체들과 논의 중이라고 발표했다 러시아가 우크라이나와의 갈등 상황에서 유럽에 에너지 공급을 끊으며 볼모 삼을 경우를 대비한 것이다 뉴욕타임스 NYT 등에 따르면 정부 관계자는 이날 발표에서 유럽이 한겨울에 급작스러운 에너지 부족 문제로 고생할 일은 없을 것이라며 미국 정부는 잠재적인 에너지 부족 문제에 대해 다수 공급원으로부터 확실한 대안을 준비하고 있다고 했다 미국이 유럽을 지원하면서 서로 단합된 모습을 러시아에 보여주기 위한 것이라고 가디언은 분석했다 이를 통해 러시아에 우크라이나 침공 포기 압박을 키울 있다는 계산이다 실제 유럽 정상들은 러시아가 우크라이나를 침공할 경우 발생할 에너지 공급 문제 때문에 러시아에 가할 제재 수위를 놓고 신중한 입장을 보이고 있다 이날 올라프 슐츠 독일 총리 에마뉘엘 마크롱 프랑스 대통령은 러시아-우크라이나 문제에 대한 입장 조율을 위해 독일 베를린에서 만났다 독일은 특히 러시아 가스관 노르스트림2가 연결돼 가스관을 포함한 모든 제재에 부정적인 입장인 것으로 알려졌다 일각에서는 푸틴이 이를 노려 한겨울에 침공 문제를 부각시켰다는 분석도 나온다 유럽을 지렛대 삼아 미국과 협상 카드로 있다는 것이다 가스와 원유  러시아에서 수입하는 유럽은 작년 러시아에서 가스  수입했다  우크라이나를 관통하는 가스관을 통해 공급됐다,국제,20220126,조선일보,"美, ""유럽 에너지 문제 없을 것""..러시아 공격 만반 준비"
유럽에서 강력한 봉쇄 조치를 도입한 나라 하나인 네덜란드가 방역 규제 완화에 나선다 네덜란드 정부는  현지 시각 코로나 확산을 막기 위해 도입한 제한 조치를 해제 한다고 발표했다 해제 조치는  적용된다 BBC 등에 따르면 네덜란드 정부는 지난  식당 카페 박물관 등의 영업을 아예 금지했다 마이크 뤼터 네덜란드 총리는 기자회견에서 규제 완화를 두고 위험을 감수하겠다고 했다 네덜란드는 강력한 봉쇄 정책에도 확진자가 계속해서 늘었다 최근에는 하루  명씩 확진자가 쏟아졌고 대비 주간 확진자가 가량 늘었다 그러나 사망자와 중증 환자는 꾸준히 줄면서 규제 완화를 요구하는 목소리가 커졌다 새로운 규제에 따라 카페 식당은 오후  영업할 있다 입장할 때는 백신 접종이나 코로나에서 회복됐다는 증명서를 제출해야 한다 나이트클럽 영업은 계속 금지된다 박물관도 다시 개장하고 스포츠나 문화 행사의 경우 최대  참석 가능하도록 수용 인원을 늘렸다 이번 조치는 우선  적용된다 BBC는 최근 네덜란드에서 방역 규제를 완화 요구가 거셌다고 전했다 특히 이달  정부가 상점 체육관 미용실 성매매업은 영업을 허가 하자 식당 주인 등의 분노가 극에 달했다 일부 도시의 카페들은 지난 주부터 정부 지침에 반대하며 문을 열었고 수십 박물관과 영화관이  항의 표시로 개장했다 암스테르담에서는 규제 완화를 요구하는 시위가 개월째 이어지고 있는데 최근 들어 빈번해졌다고 한다,국제,20220126,조선일보,'성매매'는 되는데 '박물관'은 금지했던 네덜란드..방역 규제 완화
미국의 올림픽 선수 출신 인기 유튜버가 조회수를 올리려는 목적으로 자신이 몰던 경비행기를 고의 추락시켰다는 의혹이 제기됐다 관련 당국은 사고 조사에 나섰다  현지시각 인디펜던트지에 따르면 미국 연방항공청 FAA 교통안전국 NTSB 올림픽 스노보드 선수 출신 유튜버 트레버 제이컵이 몰던 경비행기가 지난해  캘리포니아 로스 파드레스 국유림에 추락한 사고와 관련해 공동조사를 진행하고 있다 제이컵은 지난달  유튜브에 비행기가 추락했다는 제목의 영상을 올렸다 해당 영상에는 제이컵이 캘리포니아 상공으로 경비행기를 몰고 갔다가 비행기가 로스 파드레스 국유림에 추락하는 장면이 담겼다 비행기에 부착된 액션캠은 제이컵이 비행기에서 탈출하는 모습과 비행기가 추락하는 모습을 고스란히 잡아냈다 제이컵이 탈출할 비행기는 이미 동력을 상실한 보였다 제이컵은 낙하산 가방을 메고 비행기에서 뛰어내렸고 낙하산을 펴고 내려와 덤불 속에 무사히 착지했다 비행기는 제이컵이 뛰어내린 하강하다 숲에 추락했다 제이컵은 비행기를 탈출해 낙하산을 펴기 전부터 셀카봉으로 자신과 추락 중인 비행기를 촬영했고 착지하는 순간에도 이를 놓지 않았다 그는 비행기 추락지점으로 걸어가면서 죽을 뻔했다며 이래서 나는 낙하산을 갖고 다닌다고 말했다 이후 우연히 만난 농부가 자신의 생명을 구했다고 주장했다 해당 동영상은  넘는 조회수를 기록했다 그러나 네티즌들은 제이컵이 낡고 녹슨 비행기를 구입한 이유에 의문을 제기했다 영상을 보면 추락한 비행기 조종석에는 알루미늄 덕트 테이프가 붙어 있고 동체 겉면에도 녹이 슬어 있다 급기야 비행기를 고의 추락시켰을지 모른다는 의혹까지 제기됐다 영상에서 제이컵은 위를 비행하던 엔진이 고장났다고 말했으나 영상을 항공 정비 전문가들은 제이컵이 비행기가 이미 수리가 필요한 상태였다고 지적했다 논란이 일자 제이컵은 해당 동영상의 댓글 기능을 차단했다 이에 온라인상에선 영상 진위 여부를 두고 논란이 가열됐다 제이컵은 아직 별다른 입장을 내놓지 않은 상황이다 제이컵은 추락 사고 며칠 공항을 찾아 사고 사실을 전했고 비행기 사고처리 규정에 따라 FAA에 추락 사실이 신고될 것이란 이야기를 들었다 사고 며칠 그는 헬리콥터를 타고 추락 지점으로 돌아가 사고기의 잔해를 처리한 것으로 알려졌다,국제,20220126,조선일보,"비행기 떨어지는데 셀카봉을? 美 유튜버, 고의 추락 의혹"
온두라스 여성 국가원수인 시오마라 카스트로 왼쪽 대통령이  현지 시각 수도 테구시갈파 국립축구경기장에서 열린 취임식에서 취임 선서를 마치고 남편이자 대통령인 마누엘 셀라야와 마주 보고 있다 마누엘 셀라야는  취임했지만,국제,20220129,조선일보,온두라스 첫 여성 대통령
미국에서 엄마들이 밤늦게 학교 운동장에 모여 비명을 지르는 모임을 결성해 화제가 되고 있다 코로나로  집에서 육아 집안일과 재택근무를 병행하며 누적된 스트레스와 우울감을 함께 비명 지르기로 해소하자는 취지다 지난  현지 시각 뉴욕타임스 보스턴글로브 보도에 따르면 모임은 지난해  메사추세츠주 보스턴에서 처음 시작됐다 심리치료사 사라 하먼이 현지 학부모 커뮤니티와 소셜미디어를 통해 함께 소리지를 엄마들을 모집했다   둘을 키우는 하먼은 팬데믹 기간동안의 육아는 나를 완전히 미치게 만들었다며 모임 결성을 결심했다고 했다 미칠 같은 답답함을 느끼는 엄마는 하먼 만이 아니었다 금세  모였다 이들은 한밤 보스턴 찰스타운 고등학교 운동장에 둘러서서  쉬지않고 비명을 질렀다 이날 모임에 참여한  아이를 키우는 애슐리 존스는 모임은 정확히 내가 원하던 것이었다며 같은 감정을 공유하는 이들과 함께 있다는 것만으로 안전하다고 느꼈다고 했다 이후 백신 접종 가속화로 일상회복에 대한 기대감이 생기면서 비명 지르기 모임도 단발성으로 그치는 했다 그러나 지난해 연말 오미크론 변이 확산으로 모든 것이 원점으로 되돌아왔다 이달 미국의 일일 신규 확진자는  넘어섰다 미국 대다수 지역에 휴교령이 내려지고 기업들은 재택근무를 무기한으로 연장했다 이에 지난  현지 시각 엄마들은 다시 운동장에 모였다 비명 지르기 모임은 단숨에 전역 부모들 사이에서 화제가 됐다 보스턴글로브는 텍사스주 알링턴에서도 비슷한 모임이 생겼고 벨몬트와 덕스베리의 엄마들도 관심을 보이고 있다고 전했다 뉴욕타임스는 코로나 대유행 기간 동안 수백만 명의 미국 엄마들이 정신 건강의 위기에 직면해 있다며 많은 엄마들이 자신의 삶과 힘든 육아 가사일을 저글링 하면서 한계점에 다다랐다고 보도했다 뉴욕 맨해튼 정신과 의사 엘런 보라는 모든 사회구성원이 어떤 방식으로든 코로나에 영향을 받았지만,국제,20220129,조선일보,"한밤 학교 운동장 모여 비명 지르는 美엄마들, 무슨 일 있길래"
유럽연합 EU 독일 스웨덴 등이  현지 시각 북한의 잇따른 미사일 발사 도발을 규탄하는 입장을 발표했다 들어 북한이 극초음속 미사일 발사 도발을 거듭하자 미국과 일본뿐만 아니라 유럽 여러 나라와 브라질 아랍에미리트 UAE 알바니아 등이 규탄 행렬에 동참하고 있는데 이런 움직임이 더욱 확산하고 있는 것이다 반면 북핵 위협의 당사자인 우리 정부는 도발이라는 표현을 쓰지 않고 있다 우리 정부는 유엔 UN 안보리 규탄 성명 등에도 불참하고 있다 북한은 이달 들어서만 탄도미사일 발사 다섯 순항미사일 발사 도발을 감행했다 EU 대외 정책을 총괄하는 대외관계청 EEAS 대변인은 이날 성명을 내고 북한의 반복되는 미사일 발사는 국제적 지역적 평화와 안보에 위협이며 대화를 재개하고 북한 주민들을 돕기 위한 행동에 나서려는 국제적 노력에 배치된다고 했다 이어 EU는 북한에 불안정을 야기하는 행동을 중단하고 미국과 한국이 표명한 대화 의사에 건설적으로 응할 것을 반복해 촉구한다고 했다 그러면서 EU는 북한이 대량파괴무기 탄도미사일 기존 프로그램을 완전하고 검증 가능하며 불가역적 irreversible 방식으로 포기하는 목표에 전념하고 있다고도 했다 독일 외교부도 이날 대변인 명의 보도자료를 통해 단시일 다섯 번의 탄도미사일 시험발사로 북한은 유엔 안전보장이사회의 결의를 명백하게 위반했다며 지난  이뤄진 순항미사일 발사도 무책임하게 긴장을 고조시켰다고 했다 이어 북한은 안보리의 결의를 철저히 지키고 미국과 한국의 거듭된 대화 제의에 응할 것을 촉구한다고 했다 EU와 독일은 이날 성명에서 완전하고 검증 가능하며 불가역적인 비핵화 언급했다 앞서 북한의 잇따른 도발에 미일 정상이 지난  정상회담을 가진 공동성명에서 CVID를 명시했었다 한반도의 완전한 비핵화란 표현을 쓰던 미국이 CVID라는 강경 표현을 사용하자 국제 사회도 보조를 맞추는 양상이다 스웨덴 외교부도 이날 미국의소리 VOA CVID를 언급하면서 북한이 국제적 약속을 이행하고 유엔 안보리 결의에 따라 핵무기를 폐기할 것을 촉구한다고 했다 앞서 지난  린다 토머스-그린필드 유엔 주재 미국대사는 북한 미사일 도발에 대한 안보리 비공개회의 직전 공동성명을 통해 북한의 안보리 결의 위반 행위를 규탄하는 모든 이사국이 단합해야 한다고 했었다 당시 성명에는 영국 프랑스 아일랜드 알바니아 일본 브라질,국제,20220129,조선일보,EU·독일·스웨덴도 '北미사일 규탄' 릴레이 성명
