article,category,date,source,title
올해 아세안 의장국인 캄보디아의 미얀마 군사정부에 대한 친화적 태도에도 불구하고 일부 회원국들은 계속해서 반대 목소리를 내고 있다  필리핀스타 등에 따르면 테오도로 록신 필리핀 외교장관은 전날 성명을 내고 아웅산 수치 고문은 미얀마 민주주의 회복을 위해 필수적이며 반드시 평화 협상에 참여해야 한다고 밝혔다 록신 장관은 수치 고문이 없다면 대화는 무의미하다면서 군정 지도부가 폭넓은 대화를 통해 민주주의로의 이행 절차를 재개할 것을 촉구한다고 말했다 이어 지난주 군정 법원이 수치 고문에게 추가로 실형을 선고한 것을 비난했다 또한 앞서 리셴룽 싱가포르 총리는 지난  훈센 캄보디아 총리와 화상 통화에서 미얀마 군정이 유혈 사태의 평화적 해결을 위한 아세안 합의를 지키지 않으면 계속해서 회의에서 배제해야 한다고 주장했다 사이푸딘 압둘라 말레이시아 외교장관도 지난  훈센 총리의 최근 미얀마 방문에 대해 군정을 인정하는 것으로 비춰질 있어 회원국 지도자들과 사전에 논의했어야 한다고 지적했다,국제,20220120,조선일보,"필리핀 ""아웅산 수지 빼고 대화못해""..미얀마 놓고 아세안 갈등"
코로나 백신 미접종으로 호주에서 추방된 남자 테니스 세계 랭킹  노바크 조코비치가 코로나 치료제를 개발 중인 덴마크 회사의 지분을 보유하고 있다고 로이터 통신이  현지 시각 전했다 덴마크 생명공학 회사 퀀트바이오레스의 CEO 이반 론차레비치는   조코비치가 회사 지분의 인수했다고 로이터에 밝혔다 론차레비치는 코로나 바이러스가 세포를 감염시키지 못하도록 억제하는 치료제를 개발하고 있으며 올여름 영국에서 임상 시험을 시작할 것이라고 했다 로이터에 따르면 회사는 덴마크 호주 슬로베니아에서  연구원을 두고 있으며 조코비치와 그의 아내가 각각 39 지분을 보유하고 있다 조코비치의 대변인은 이에 대해 입장을 밝히지 않았다 로이터는 조코비치가 다시 한번 영광을 되찾기 위해 코로나 치료제에 희망을 걸고 있다고 전했다,국제,20220120,조선일보,"백신 거부하더니..""조코비치, 코로나 치료제 회사 지분 80% 보유"""
조 바이든 대통령의 취임  기자회견에서 나온 질문과 그에 대한 바이든 대통령의 답이다 바이든 대통령은 이날 모두 발언에서   미국인들이 코로나 완전 접종을 했다며   새로운 일자리를 만들었고 실업률은 떨어졌다고 했다 빈곤률은 가까이 감소했고 소득은 올라갔다며  성과를 강조했다 그러나 백악관 출입기자들의 평가는 싸늘해 보였다 최근 유가가  만에 최고치를 기록하고 있다 미국인들이 식료품점이나 주유소에 가서 앞으로도 계속 이런 높은 가격을 봐야하는 것이냐 핵심 법안이 의회에 계속 막혀 있는데 어떻게 것이냐 등의 질문이 이어졌다 바이든 대통령은 이날 연설 초반부에서 코로나 팬데믹 상황에 대해 상당 부분 할애했다 그는 코로나 바이러스로 나라에 많은 좌절과 피로가 있다는 것을 안다며 우리는 우리가 있는 모든 것을 하고 있으며 우리가 있는 빨리 배우고 적응하고 있고 전염병을 넘어 미래를 준비하고 있다고 했다 이어 팬데믹에도 미국의 이상의 학교가 여전히 문을 열어놓고 있다고도 했다 이어 경제 봉쇄로 돌아가거나 학교 대면 수업을 화상으로 전환하지 않을 것이라고 했다 이어 그는 우리는 바이러스와 싸울 있는 도구가 있다 백신이다라며 부스터샷 마스크 바이러스 테스터기 등은 생명을 구하고 기업과 학교를 계속 운영하도록 돕고 있다고 했다 예방접종이 효과가 있다며 예방접종 노력을 지속할 것이다 그러니 예방 접종을 하라고도 했다 바이든 대통령은 우리는 현재 코로나 바이러스 검사 수를 늘리고 있다 우리가 일찍 많은 검사를 위한 준비를 했어야 했나 그건 사실이다라고 했다 오미크론이 전역에 급속도로 퍼지면서 미국 코로나 테스터기가 부족한 상황에 대해 정부 대처가 부족했다는 점을 인정한 것이다 이어 바이든 대통령은 그러나 우리는 지금 많은 조치를 취하고 있다며  미국 가정에서의 테스터기가 전무했던 것을 생각해보라 이번 미국 시장에서   개의 테스터기가 풀렸다고 했다 바이든 대통령은 인플레이션에 대해선 가격 상승을 통제해야 한다며 물가 안정은 연준 Fed 책임이라고 했다 높은 물가가 고착되지 않도록 하는 중요한 일은 완전 고용과 안정적 물가라는 이중 권한을 가진 Fed가 일이고 Fed를 존중한다고 했다 바이든 대통령은 러시아의 우크라이나 위협에 대해선 러시아가 침공을 강행하면 재앙 disaster 겪을 것이라며 심각한 경제적 제재를 준비하고 있다고 했다 이어 러시아의 은행이 달러를 결제할 없을 것이라고도 했다 러시아를 국제금융정보통신망 SWIFT 에서 배제하는 방안을 언급한 것으로 해석됐다 SWIFT 통신망은 각국 금융기관이  또는  코드를 이용해 국제금융 결제를 있는 시스템을 말한다 세계 주요 은행과 금융회사  곳이 이용 중이다 시스템 접속이 차단되면 국제금융거래망에서 사실상 퇴출된다 바이든 대통령은  재선에 출마할 것이라는 취지로도 말했다 카멀라 해리스 부통령의 업무에 만족하고 있느냐  대통령의 러닝메이트가 것으로 보나라는 질문에 주저하지 않고 그렇다라고 했다 그는 나는 해리스 부통령에게 투표권 확대 법안 추진 임무를 위임했다 나는 그녀가 일을 하고 있다고 생각한다라고 했다 바이든 대통령은 그의 핵심 어젠다인 복지 법안이 의회에 막혀 있는 상황에 대해선 도널드 트럼프 대통령을 비난하기도 했다 그는 트럼프 대통령을 직접 거론하지는 않은 여러분은 어떤 사람이 정당 전체를 위협하고,국제,20220120,조선일보,"인플레, 팬데믹, 법안 정체에도..바이든 ""과도한 약속한 적 없다"""
일본의 자원개발회사 인펙스 INPEX 남서부 시마네 야마구치 동해에서 석유와 천연가스 개발에 착수한다 일본이 바다에서 석유 가스를 채굴하려는 시도는  만으로 연간  이상의 생산이 가능하다는 분석이 나오고 있다  니혼게이자이신문에 따르면 INPEX는 시마네 야마구치현 앞바다에 석유 천연가스의 매장 가능성을 알아보기 위한 시험채굴 시굴 조사를 오는  실시한다며 지역에서 석유 천연가스 상업 생산이 실현된다면 일본 에너지 자급률 향상에 기여할 있을 것이라고 발표했다 채굴 장소는 야마구치현에서 북쪽으로 시마네현에서 북서쪽으로 떨어진 수심 지역이다 일본이 해양에서 석유 가스 개발을 본격 추진하는 것은  생산을 개시한 니가타 앞바다 이와후네오키 유전 가스전 이후 처음이다 회사는  시마네현에서 후쿠오카 현에 이르는 바다에서 석유 가스전 존재 여부를 조사해왔다  경제산업성과 함께 시마네 야마구치 앞바다를 탐사했다 결과 석유 가스층이 존재할 가능성이 높다고 판단 올해 본격적인 시험채굴 사업에 착수한다고 설명했다 이와 관련 주일 한국 대사관은 일본 측의 시험채굴 지점이 한국이 주장하는 배타적경제수역 EEZ 내에 있는지를 확인하고 있다 니혼게이자이신문은 이번 조사에 대해 상업화할 있는 매장량이 있는지 확인하는 차원이라며 상업화 가능성이 확인된다면  개발 준비에 착수해  생산을 개시할 계획이라고 전했다 사업비  절반은 일본 경제산업성 산하 독립 행정법인 일본 석유천연가스 금속광물자원기구 JOGMEC 부담한다 일본 경제산업성이 국제 정세와 무관하게 에너지를 안정적으로 확보하려면 국내 자원 개발이 중요하다고 판단하고 있기 때문이다 일본은 한국과 마찬가지로 천연가스 대부분을 해외 수입에 의존하고 있다  천연가스 수입량은  국내 생산량  압도하는 실정이다 자급률로 따지면 수준이다 이번 시마네 야마구치 앞바다에서 기대하는 가스 생산량은  이상으로,국제,20220119,조선일보,"日, 30년만에 동해서 석유·천연가스 개발 착수"
미국의 목사가 설교 도중 신도 눈에 자신의 침을 바르는 행위를 비난을 받았다  현지 시각 폭스뉴스 등에 따르면 미국 오클라호마주 변화의 교회 Transformation Church 마이클 토드 목사는 지난  설교 도중 자신의 손에 침을 뱉은 신도의 눈에 문질렀다 소셜미디어에 확산한 당시 영상을 보면 토드 목사는 신도를 옆에 세워둔 자신의 손에 침을 뱉는다 일부 신도들이 놀라는 모습을 보였지만 토드 목사는 다시 가래침을 모아 뱉은 하느님의 비전을 받는 것은 불쾌할 있다고 말한다 이후 손바닥에 모은 침을 섞더니 옆에 서있던 신도의 얼굴에 문지른다 지켜보던 신도들은 소리를 지르고 야유를 보낸다 해당 영상은 온라인으로 확산했고  이상의 조회수를 기록했다 네티즌들은 불쾌하다는 반응을 보였다 지역 스포츠 기자인 크리스 윌리엄슨은 토드 목사가 일을 변호할 방법이 없다며 기독교의 이름으로 행해진 가장 혐오스러운 행동 하나라고 했고 잡지 소속의 작가는 역겹다고 적힌 meme 함께 신은 어디에도 없다고 썼다 토드 목사는 케빈 스티트 오클라호마주 주지사와 함께 코로나로부터 주를 보호한다며 예배를 적이 있다 네티즌들은 당시 기도를 놓고 홍보용이라는 비판을 쏟아냈다,국제,20220119,조선일보,"""코로나 끝나길"" 美목사, 설교중 신도 눈에 침 발랐다"
대규모 해저 화산 폭발이 휩쓸고 지나간 남태평양 섬나라 통가의 피해 상황이 속속 드러나고 있다 화산이 폭발한 곳에선 여의도 크기의 육지가 사라졌다 수도 누쿠알로파를 비롯한 해안가 휴양 시설은 파도에 쓸려나가고 화산재로 뒤덮여 쑥대밭이 됐다  현지 시각 유엔 위성사진 분석 기관 UNOSAT 미국 우주기술 업체 맥사테크놀로지 등이 공개한 통가 일대 위성사진에 따르면 지난  해저 화산 폭발로 이곳에 있던  육지가 흔적도 없이 사라졌다 서울 여의도  육박하는 면적이다 영국 BBC 외신은 통가에 거주하던 영국 출신 여성 앤절라 글로버 이번 화산 폭발로 인한 사망자로 확인됐다고 전했다 그는 자신이 돌보던 유기견들을 구하러 동물보호소로 향하다가 쓰나미에 휩쓸렸다고 한다 통가 정부는 글로버와 망고 섬의  여성 노무카 섬의  남성  사망했다고 공식 확인했다 화산 폭발로 해저 통신 케이블이 끊어지면서 통가 현지의 정확한 피해 규모 파악이 늦어지고 있다 AFP 통신은 케이블 수리에  걸릴 것으로 전망했다 호주와 뉴질랜드 인근 국가는 정찰기를 보내 피해 규모 파악에 나섰다 구호품을 실은 비행기는 주요 공항 활주로에 쌓인 화산재 탓에 착륙하지 못하고 있다 뉴질랜드 정부 관계자는 구호품을 실은 해군 함정이 통가에 도착하기까지  걸릴 것이라고 밝혔다 케이티 그린우드 국제적십자연맹 IFRC 태평양 지역 단장은 BBC 인터뷰에서 통가 전역에 걸쳐 최대  피해를 당했을 것이라며 다행히 주요 인구 중심지까지 재앙이 닥치진 않은 것으로 보인다고 말했다 유엔 인도지원조정국 OCHA 화산 활동이 있을 가능성을 배제할 없다고 전했다,국제,20220119,조선일보,통가 대규모 화산 폭발로 여의도 크기의 땅이 사라졌다
미국 상무부가 중국의 빅테크 기업인 알리바바의 미국 클라우드 가상 저장 공간 사업이 자국 국가 안보에 위협 요소로 작용하는 여부를 검토하고 있다고 로이터통신이  현지 시각 보도했다 정부가 알리바바의 클라우드 서비스에 대한 제재를 부과할 경우 알리바바의 타격이 상당할 전망이다 앞서 정부 제재로 중국 최대 통신장비 스마트폰 제조사 화웨이는 매출이 급감했었다 로이터에 따르면 이번 상무부 조사 초점은 알리바바가 개인 정보 지식재산권을 포함한 고객의 정보를 어떻게 저장하는지다 이와 함께 중국 정부가 알리바바의 온라인 저장 공간에 있는 사용자 정보에 대한 접근이 가능한 여부도 걱정거리라고 로이터는 소식통을 인용해 전했다 규제 당국은 알리바바에 개인 정보 노출에 대한 위험을 줄일 조처를 강제하거나 아니면 미국 기업이 아예 서비스를 이용하지 못하도록 제재를 부과할 가능성이 있다고 한다 앞서 트럼프 행정부도 이에 대한 우려를 갖고 있었지만 정식 조사는 이달 들어서야 시작된 것으로 알려졌다 알리바바 주가는 이날 주식 시장 개장전 가까이 하락했고 이날 오후에도 넘는 하락세를 보였다 알리바바는 작년 클라우드 서비스로  달러  수입을 올리며 성장했다 현재 세계  클라우드 서비스 기업이고 알리바바는 서비스를 성장의 두번째 축이라고 부르며 공을 들여왔다 미국 클라우드 사업은 초기 단계이지만 계속 성장 중이다 지난  알리바바는 실리콘밸리에 클라우드 컴퓨팅 허브를 출범했고 버지니아주에도 데이터 센터를 추가로 설치했다 그러나 트럼프 행정부 시절 중국과 갈등이 고조되면서 미국 사업 계획을 축소한 상태다 로이터통신은 규제 당국이 궁극적으로 미국 기업과 알리바바 클라우드 간의 거래를 차단하기로 결정한다면 그것은 회사의 가장 유망한 사업 하나에 손상을 입히고 회사 전체의 명성에 타격을 것이라고 전했다 트럼프 행정부는 지난   알리바바 중국 클라우드 서비스 기업들을 겨냥한 성명을 내고 미국 시민의 가장 민감한 개인정보와 우리 기업들의 가장 가치 있는 지적재산을 보호하기 위해 적성 국가의 기업이 운영하는 클라우드 시스템에 이런 정보가 저장 처리되는 것을 방지해야 한다고 했었다 이번 조사는 정보보안국으로 알려진 상무부 소규모 부서가 주도하고 있다 이는 트럼프 행정부가 신설한 것으로 중국 러시아 쿠바 이란 북한 베네수엘라와 같은 적성국들과 미국 기업과 인터넷 통신,국제,20220119,조선일보,美 중국 알리바바 '클라우드' 사업 조사착수..'안보 위협' 초점
백악관이 러시아가 언제든지 at any point 우크라이나에 대한 공격을 시작할 있다고  현지 시각 밝혔다 미국 국방부도 러시아 측이 긴장을 완화하려 한다는 징후는 없다면서 이를 뒷받침했다 백악관과 국방부는 블라디미르 푸틴 러시아 대통령이 외교적 해법과 가혹한 경제 제재 사이에서 선택을 해야 한다고 강조했다 이런 가운데 토니 블링컨 미국 국무장관은 이날 세르게이 라브로프 러시아 외무장관과 전화 통화를 갖고 스위스 제네바에서 직접 만나 회담을 하기로 합의했다 국무부는 블링컨 장관이 동맹 파트너들과의 연대 표현 전략 조율을 위해  우크라이나 수도 키예프와 독일 베를린을 방문할 예정이라고 밝혔다 사키 백악관 대변인은 이날 백악관 브리핑에서 푸틴 대통령이 우크라이나 국경에  대군을 집결시켜서 위기를 조성했다며 최근에는 벨라루스와의 합동 훈련 우크라이나 동부 국경에서의 추가 훈련이란 명목으로 벨라루스에도 러시아군을 이동시켰다고 말했다 러시아가 우크라이나 동북쪽 국경을 에워싼 이어 키예프 바로 북쪽에 있는 벨라루스에도 합동 훈련을 이유로 병력을 이동시킨 점을 지적한 것이다 사키 대변인은 분명히 말하자면 이것은 매우 위험한 상황이라고 우리는 생각한다며 우리는 이제 러시아가 언제든지 우크라이나에 대한 공격을 시작할 있는 단계에 와있다고 본다고 했다 그러면서 블링컨 국무장관이 러시아와의 외교를 통해 하려는 것은 외교적 길이 있다는 점을 분명히 강조하는 것이다 가혹한 경제적 후과를 치를지 말지 결정하는 것은 푸틴 대통령과 러시아인들의 선택이라고 했다 커비 미국 국방부 대변인은 이날 브리핑에서 우리는 계속해서 상당히 많은 러시아 병력이 우크라이나와 맞닿은 러시아 서부 우크라이나 동북쪽 국경에 주둔하고 있는 것을 보고 있다고 말했다 그는 러시아 측이 긴장을 완화시키려 한다는 징후는 없다며 우리 외교관들이 지난  회담에서 말한 것처럼 우리는 러시아가 호혜적 조치를 한다면 나토군의 훈련 규모와 폭을 바꾸는 것에 대해 대화할 의지가 있다고 말했다 커비 대변인은 우리는 계속해서 외교적 길을 추구할 것이다 그리고 길이 실패해서 러시아 병력이 우크라이나를 다시 침공할 때에 대해서도 대비가 되어있도록 확실히 것이라고 했다 푸틴의 의도 묻는 질문에 그는 무엇이 그를 이끄는지 그의 목적이 무엇인지 구체성과 정확성을 갖고 말하기는 어렵다면서도 병력 증강은 확실히 그에게 여러 선택지를 주었다 그가 무엇을 선택할지 지금 아는 것은 어렵다고 했다 커비 대변인은 물론 우리는 그가 긴장 완화의 길을 선택하기를 원하고 가장 쉬운 방법은 병력을 철수시키는 것이지만 그런 모습은 보이지 않는다고 말했다 한편 블링컨 국무장관은 이날 라브로프 러시아 외무장관과 통화를 했다 국무부는 블링컨 장관이 우크라이나의 주권과 영토 완정에 대한 미국의 흔들림 없는 공약을 강조하고 유럽의 안보 논의는 반드시 나토 동맹 우크라이나를 포함한 유럽 파트너들과 함께 해야 한다고 강조했다고 전했다 한편 라브로프 장관은 이날 모스크바를 방문한 아날레나 배어복 독일 외무장관과의 공동 기자회견에서 나토 확장 금지를 포함한 러시아의 안보 요구가 받아들여져야 한다고 다시 주장한 것으로 러시아 언론들이 전했다 블링컨 장관은 라브로프와의 통화 직후인 이날 오후 워싱턴DC를 떠나 우크라이나 수도 키예프로 출발했다 블링컨 장관은 볼로디미르 젤렌스키 우크라이나 대통령 드미트리 쿨레바 우크라이나 외교장관과 회담을 갖고 우크라이나의 주권과 영토 완정에 대한 미국의 지지를 강조할 것이라고 국무부가 전했다 국무부 고위 관계자는 이날 언론 브리핑에서 블링컨 장관은  독일 베를린에 가서 독일 정부 대서양 쿼드 협의를 것이라며 러시아의 행동에 대한 단합된 반응을 위한 것이라고 했다 러시아의 침공이 얼마 남지 않았다고 가정하면 초읽기 외교가 시작된 셈이다,국제,20220119,조선일보,"백악관 ""러시아, 언제든 공격 가능"".. 우크라에 국무장관 급파"
미성년자의 게임 시간을 엄격히 통제하는 중국이 춘제 연휴  이틀간 미성년자의 게임 접속을 허용하지 않을 것으로 보인다  중국 기술 전문 매체 IT즈자 등에 따르면 중국 최대 게임사인 텐센트는  중순까지 미성년자들이 게임에 접속할 있는 날짜와 시간을 공고했다 올해 춘제는 오는  다음달  텐센트는 토요일과 일요일인  미성년자의 접속이 불가능하고  다음달   접속할 있다고 밝혔다  이어지는 춘제 연휴 기간 동안 중국 미성년자들은  게임을 있는 것이다 텐센트는 미성년자의 온라인 게임 중독을 더욱 엄격히 관리하기 위함이라고 덧붙였다 중국 당국은 작년  어린이와 청소년 게임 중독을 막겠다는 명분으로 미성년자가 게임을 있는 시간을 또는 법정 공휴일  제한하고 있다 이에 따라 당초 미성년 게이머들은 연휴 기간  포함해  정도 게임을 있을 것으로 기대했다 하지만 중국 최대 게임사 텐센트가 같은 추가 제한 조치를 내놓으면서 업계 전반에 영향을 것으로 보인다고 현지 언론들은 전했다,국제,20220119,조선일보,"중국 청소년들, 춘제연휴 9일 중 7시간만 게임할 수 있다"
WHO 관계자가 영국이 코로나가 종식되는 번째 나라가 가능성을 언급했다 오미크론 변이 발생 급증했던 영국의 신규 코로나바이러스 확진자가 빠르게 줄어들면서다  현지 시각 영국 일간 더타임스는 데이비드 나바로 WHO 코로나 특사가 스카이뉴스와 인터뷰를 인용해 나바로 특사가 영국의 관점에서 보자면 터널 끝에 빛이 보이는 것과 같다 다만 끝까지 가는 길은 순탄하지 않을 것이라 말했다고 보도했다 영국의 전날 코로나 신규 확진자는  일주일 넘게 줄었다 지난  입원 환자수도   일주일간 연속 감소했다 특히 코로나 검사 양성률 역시 이달 이상에서 아래로 떨어졌다 앞서 영국 총리실은 전국적으로 감염이 감소하는 희망적 모습들이 나타나고 있다고 발표했고 영국 정부는 백신 패스 주요 방역 조치를 폐지하는 방안을 검토하고 있는 것으로 알려졌다 한편 나바로 특사는 코로나 종식이 멀지 않았다고 상상하면서도 모든 사람들이 다른 변이나 심지어 오미크론이 다시 급증하는 경우에 대해서도 대비해야 한다며 경계의 목소리도 늦추지 않았다 그러면서 지구 어디에서도 조짐이 좋은 곳은 없다며 병을 전염시키지 않기 위한 노력을 철저히 해야 한다 코로나는 단순히 심한 감기가 아니다고 했다 앞서,국제,20220119,조선일보,"""터널 끝 빛 보인다"" WHO, 영국 코로나 종식 가능성 언급"
미국발 조기 긴축 우려로 시장 금리가 먼저 들썩이면서  현지시각 뉴욕증시가 급락했다 반면 국제유가는 중동발 긴장 우려로 폭등하고 있다 마틴루터킹데이 연휴 뉴욕증시가 개장한 이날 다우지수는 전장보다 P500 지수는 하락했다 특히 금리 동향에 민감한 기술주들이 폭락하면서 나스닥 지수는 이나 급락 마감했다 이날 뉴욕증시 하락은 미국 중앙은행인 연방준비제도 Fed 연준 긴축이 예상보다 크고 빨라질 것이란 불안감 때문으로 해석됐다 이미 연준은 지난달부터 미국의 급격한 물가상승에 대응해 테이퍼링 자산매입 축소 이어 이르면 올해  팬데믹 금리 인상에 돌입하겠다고 예고했다 증시 안팎에선 금리 인상이  높아지고 상승폭도 당초 예상보다 높아질 있다는 우려가 높아지고 있다  미국 국채 금리는 이날 팬데믹 직전인   이후 처음으로 돌파했고  금리도   이후  최고치를 찍었다 한편 이날 국제유가는 배럴당   최고치를 경신했다 주요 산유국인 아랍에미리트연합 UAE 석유 시설에 대한 예멘 반군의 공격 러시아의 우크라이나 침공 가능성이 고조되면서 러시아산 원유 생산 차질 가능성이 높아졌기 때문이라고 월스트리트저널은 분석했다 북해산 브렌트유는 배럴당  거래 마감했고 서부 텍사스산 원유 WTI 오른  거래를 마쳤다 모두 미국산 셰일오일의 등장으로 유가 하락이 본격화됐던   이후 최고치였다 골드만삭스는 올해 안에 유가가  돌파할 있다 골드만삭스 경고했다,국제,20220119,조선일보,긴축 우려에 뉴욕증시 급락.. 중동 긴장에 국제유가는 폭등
