article,category,date,source,title
러시아의 우크라이나 침공 가능성이 고조되고 있는 가운데 미국이 우크라이나 수도 키예프 있는 미국 대사관 직원 가족들에 대해 철수 명령을 내리는 한편 러시아로 여행하지 것을 권고했다  현지시간 CNN에 따르면 국무부는 이날 러시아의 계속되는 군사행동에 대한 위협으로 키예프 대사관에서 미국 정부가 직접 고용한 인력에 대한 자발적 출국을 허용하고 키예프 소재 대사관 직원의 가족에게 출국을 명령했다 밝혔다 국무부는 우크라이나에 있는 미국 시민은 상업용이나 민간용 이용 가능한 다른 교통수단을 이용해 지금 출발하는 것을 고려해야 한다 밝혔다 이번 조치와 관련 CNN은 러시아가 우크라이나 국경 인근에 병력과 장비를 계속 배치하는 침공 재개될 것이라는 우려가 커지자 대사관이 국무부에 이런 조치를 요청했다고 보도했다 다만 국무부는 키예프에 있는 대사관은 우크라이나 지원을 위해 중단 없이 운영될 것이라고 했다 CNN은 우크라이나 국방부를 인용해 러시아가 현재 지역에  이상의 병력을 배치했다고 전했다 이미 국무부는 우크라이나에 최고 수준의 여행 경보를 발령한 상태다 러시아가 우크라이나에 대한 중대한 군사활동을 계획하고 있다는 보도에 유의하라고 했다 이런 가운데 영국 외무부는 러시아가 우크라이나 침공을 고려하면서 키예프에 러시아 정부를 세울 계획이라는 정보를 입수했다고 밝혔다 이와 관련 국무부는 우리는 러시아가 우크라이나를 불안정하게 만들려는 시도에 대해 매우 우려하고 있다 답했다 국무부는 이날 미국인들에게 러시아 여행을 자제하라는 여행경보를 발표했다 국무부는 우크라이나 국경을 따라 계속되는 긴장에 따라 러시아로 여행하지 말라 했다 이어 미국인들은 괴롭힘 직면할 있으며 미국 대사관은 미국 시민을 돕는 제한된 능력을 가질 있다 덧붙였다 앞서 토니 블링컨 국무장관은 세르게이 라브로프 러시아 외무장관과 지난  스위스 제네바에서 우크라이나 사태와 관련 회담을 했지만 합의점을 도출하지는 못했다 다만 블링컨 장관은 러시아에 대한 즉각적인 경제 제재 조치와 관련해선 부정적인 입장을 밝혔다 블링컨 장관은 이날 CNN에 출연해 제재의 목적은 러시아의 공격을 단념시키는 있다 만약 지금 제재가 발동되면 전쟁 억지 효과를 잃는다 말했다 그는 러시아에 대한 외교적 설득을 진행한다면서도 우리가 하는 모든 일은 블라디미르 푸틴 대통령의 계산법을 고려하고 그들의 공격적인 행동을 저지하기 위해 고안됐다 말했다,국제,20220124,뉴스1,"美, 우크라 대사관 직원 가족 철수령..러시아 여행 자제 권고(종합)"
하야시 요시마사 일본 외무상이 일제 강점기 조선인 강제노역이 이뤄진 니가타현 사도 광산 유네스코 세계문화유산으로 추천과 관련 한국의 주장을 받아들일 없다고 밝혔다  산케이신문에 따르면 하야시 외무상은 이날 중의원 예산위원회에서 다카이치 사나에 자민당 정무조사회장의 질문에 대해 한국에 대한 외교적 배려를 것은 전혀 없다 한국 측의 독자적인 주장을 받아들일 없다고 강력히 건의했다 밝혔다 앞서 다카이치 정조회장은 사도 광산 추천과 관련 지난  기자회견에서 당당하게 추천해야 한다 일본의 명예가 걸린 이라고 주장했다 이어 이날도 반드시 올해 추천을 실시해야 한다 했다 산케이는  세계문화유산 등록을 목표로 경우 정부는 다음달  유네스코에 신청서를 제출해야 한다고 전했다 하지만 한국 정부는 한반도 출신자들이 사도 광산에서 가혹한 노동에 종사했다며 반발하고 있으며 일본 정부는 세계문화유산 등재가 어렵다는 이유로 추천 보류쪽으로 가닥을 잡았다고 했다 일본 정부 차원의 추천 보류 검토는 유네스코가 지난해부터 세계기록유산에 관련국들의 이의 제기가 가능하도록 하고 결론이 때까지 등재하지 않는 제도를 도입했기 때문이다 문제는 제도가 전쟁 일본군이 벌인 만행인 난징대학살 관련 자료를 세계기록유산에 등재하는 것을 막기 일본이 주도했다는 점이다 한국의 강력한 반발과 일본의 자가당착 행동은 자칫 국제사회의 신뢰를 떨어뜨릴 있다는 지적이 제기되고 있다 여기에 세계문화유산위원회는 한번 불가하다고 판단한 추천 후보를 다시 등재한 경우는 없어 일본의 고민은 더욱 깊어지고 있다,국제,20220124,뉴스1,"日외무상 ""사도광산 세계문화유산 추천, 한국측 주장 수용불가"""
남태평양 섬나라 통가에 쓰나미가 닥쳤을 바다로 휩쓸려 나간 장애인 남성이  만에 자력으로 살아 돌아와 화제라고 미국의 CNN이  현지시간 보도했다 화제의 주인공은 올해  리살라 폴라우다 그는 제대로 걷지 못하는 장애를 갖고 있음에도 자력 생환했다고 CNN은 전했다 그는 쓰나미에 휩쓸린 인근  무인도를 거쳐 결국 본섬에 상륙해 자신의 집으로 돌아올 있었다 통가는  섬으로 이뤄진 제도로 가운데  섬에만 사람이 살고 있다 은퇴한 목수인 그는 통가 본섬에서 북쪽인 작은 아타타에 살고 있었다 그는 지난  해저 화산이 분출해 쓰나미가 바다에 휩쓸렸다 그는 인근 개의 무인도를 거친 결국 본섬에 도착할 있었다 그는 사력을 다해 헤엄친 끝에 본섬 통가타푸에 상륙할 있었고 도로를 지나가는 차를 붙잡아 구조를 받을 있었다 그가 무인도 곳을 거쳐 본섬까지 가는 데는  걸렸고 이동 거리는 달했다 이같은 소식이 알려지자 SNS에서는 그를 현실판 아쿠아맨 으로 칭송하고 있다 그가 다리가 불편한 장애인이었다는 사실도 함께 알려지면서 그의 생환기가 더욱 관심을 끌고 있다고 CNN은 전했다,국제,20220124,뉴스1,통가 '아쿠아맨' 기적..쓰나미 휩쓸린 장애인 27시간만에 생환
중국 중앙은행 인민은행이  역레포 환매조건부채권 금리를 인하해 은행 시스템에 유동성 수단을 통해  공급했다 인민은행은   역레포금리를 에서  bp  낮췄다 인민은행은 이날 온라인 성명을 통해 이번에 공급된 유동성에 대해 음력설 춘제 앞두고 유동성을 안정적으로 유지하기 위한 이라고 설명했다 중국 춘제연휴는 이달  시작해 다음달   인민은행이 지난주 중단기 대출금리를 만에 처음으로 연달아 인하한 만큼 이날  역레포 금리인하는 놀랄 만한 일은 아니라고 트레이더들은 로이터에 말했다,국제,20220124,뉴스1,"中인민은행, 설연휴 前 14일짜리 역레포 금리 10bp인하"
월가의 유명 투자은행인 모간스탠리가 최근 급락하고 있는 기술주를 저가 매수하지 말라고 충고했다고 블룸버그통신이  현지시간 보도했다 모간 스탠리의 앤드류 슬리먼 수석 포트폴리오 매니저는 기술주가 급락하자 저가 매수의 유혹에 빠지는 투자자들이 있을 것이라고 전제한 금리인상으로 기술주가 더욱 떨어질 가능성이 크기 때문에 저가매수를 하지 말라고 권고했다 그는 이날 주식투자 전문 팟캐스트에 참여해 현재 그가 투자하고 있는 종목을 소개하며 이같이 밝혔다 그는 기술주가 급락하면 저가매수에 힙입어 역추세 랠리를 하는 경우가 종종 있다며 이같은 사례를 여러 차례 봤지만 결국 하락했다고 말했다 그는 대세 하락기에 기술주에 투자하는 것은 위험하다고 강조했다 최근 미국 연준이 금리인상 모드에 접어듦에 따라 기술주 중심인 나스닥은 연일 하락하고 있다 나스닥은 지난 주에만 하락하는 들어 급락했다,국제,20220124,뉴스1,"모간스탠리 ""기술주 저가매수하지 말라"" 경고"
23일 현지시간 미국 수도 워싱턴DC에서 정부의 신종 코로나바이러스 감염증 코로나19 백신 접종 의무화에 반대하는 대규모 집회가 열렸다고 워싱턴포스트 WP 보도했다 보도에 따르면 이번 집회는 도널드 트럼프 대통령 지지 세력들이 주도한 것으로 보인다 참가자 대부분은 백인으로 트럼프 대통령을 지지하는 슬로건과 장비들을 장착하고 있었다 이들은 바이든 대통령을 비난 구호인 바이든 꺼져라 Fuck Joe Biden 렛츠 브랜던 Let Go Brandon 등을 연호했다 백신은 바이오 무기들을 대량 살상한다 트럼프가 이겼다 등의 허위 문구가 담긴 포스터와 깃발을 들고 다녔다 아울러 이날 집회에서는 백신 안전성에 대한 불신보다는 백신 접종 의무화에 대한 반대 목소리가 주를 이뤘다 연방 정부의 백신 접종 의무화에 반발하는 공무원들도 시위에 가담했다 시카고 출신 백신 미접종자 매트 시위 주최자는 일반적으로 우리를 인류애를 신경 쓰지 않는 별난 사람이나 괴짜라고 부르는데 이는 전혀 사실이 아니다 라고 말했다 튠은 우리 목적은 백신 접종자 미접종자 민주당원 공화당원들이 모두 연대해 화합하는 통일된 전선을 보여주는 이라며 이번 집회가 같은 인식을 바꾸는 도움 되길 바란다 밝혔다 시위대는 백신 접종 의무화 조치를 과거 나치 독일과 소련과 같은 권위주의 정부 행동에 비교하는 것에 지지를 외쳤으며 백신 접종을 지지하며 과학적 증거를 보도하는 언론 매체들을 향해 격분하기도 했다 주최 측은 이날 워싱턴 기념탑에서 링컨 기념비까지 거리 행진에  참석했다고 추산했다 이른 오후부터 링컨 기념관 앞에는 수천명의 참가자들이 모여들었다 다만 경찰 당국은 시위 과정에서 사건 사고나 체포자는 없었다고 보고했다 질병통제예방센터 CDC 지난  백신 접종이 감염을 효과적으로 예방하진 못하지만 오미크론 감염에 따른 입원은 막을 있다는 연구 결과를 발표했지만 성인   여전히 미접종 상태로 남아있다,국제,20220124,뉴스1,"""백신 의무화, 나치 독일 정부냐""..美 워싱턴서 반대 집회"
화이자 최고경영자 CEO 앨버트 불라가 신종 코로나바이러스 감염증 코로나19 싸우기 위해선 부스터 샷을  번씩 접종하는 것보다  접종하는 바람직할 것이라고 말했다 로이터통신에 따르면 불라 CEO는 이스라엘 매체 N12와의 인터뷰에서  정기적으로 부스터 샷을 접종하는 것을 보느냐 질문에 그것은 좋은 시나리오가 아니다 라며 내가 바라는 것은  백신을 접종하는 이라고 답했다 그는  맞는 것이 사람들이 그렇게 하도록 설득하기 쉽다 사람들이 기억하기도 쉽다 따라서 공중 보건의 관점에서 이렇게 하는 것이 이상적인 상황 이라고 강조했다 불라 CEO는 오미크론 변이를 커버하면서 다른 변이들도 잊지 않는 백신을 만들 있는지 알아보고 있다 그것이 해결책이 있을 이라고 덧붙였다 불라 CEO는 화이자가 오는  오미크론 변이를 퇴치하기 위해 재설계된 백신을 승인받아 대량 생산할 있을 것이라고 밝혔다,국제,20220123,뉴스1,"""부스터샷, 1년에 1번 접종이 가장 이상적""-화이자 CEO"
세계 최초로 비트코인을 공식화폐로 채택한 엘살바도르가 비트코인이 폭락하자 저가 매수에 나섰다 부켈레 대통령은  현지시간 자신의 트위터를 통해  달러를 들여 비트코인  구입했다고 밝혔다 그는 비트코인이  만에 최저가로 내려가자 이를 저가매수의 기회로 활용했다고 밝혔다 엘살바도르는  선에서 비트코인을 대거 매입했다고 블룸버그는 분석했다 이날 비트코인은 한때  대까지 밀렸었다 이로써 엘살바도르 비트코인 보유량은  이는 현재가치로  달러에 달한다 부켈레 대통령은 자신의 트위터에서 비트코인을 싼값에 매입할 있었다 흡족해 했다 최근 들어 엘살바도르는 비트코인이 급락할 때마다 비트코인을 저가 매수해 오고 있다,국제,20220123,뉴스1,엘살바도르 비트코인 폭락하자 또 저가매수..410개 매입
비트코인이 폭락세는 멈추고  대에서 거래되고 있다 비트코인은  오전  현재 한국시간 기준 글로벌 코인시황 중계사이트인 코인마켓캡에서  전보다 하락한  기록하고 있다 이날 비트코인은  밀렸었다 이는 지난  기록한 최고점에서 이상 폭락한 것이다 그러나 저가 매수가 유입되면서 비트코인은 폭락세를 멈추고  대에서 거래되고 있다 실제 비트코인을 법정통화로 채택한 엘살바도르는 비트코인이 폭락하자 저가 매수에 나섰다 나이브 부켈레 대통령은 이날 자신의 트위터를 통해 비트코인  추가로 매입했다고 밝혔다 이같은 영향으로 비트코인은 폭락세를 멈추고 반등을 시도하고 있는 것으로 보인다,국제,20220123,뉴스1,비트코인 폭락세는 멈춘 듯.. 3만5000달러 대에서 거래돼
,국제,20220122,뉴스1,[속보] 日 오이타현 사이키시 인근 해안서 규모 6.6 지진 발생
조 바이든 미국 대통령은  현지시간 기시다 후미오 일본 총리와의 화상 정상회담과 관련해 기시다 총리를 만나 영광이었다 밝혔다 바이든 대통령은 이날 정상회담 트위터에 글을 올려 미일 동맹을 더욱 강화하기 위한 만남이었다며 이렇게 말했다 그는 이어 미일 동맹은 인도태평양과 세계에 걸쳐 평화와 안보의 초석 이라고 강조했다 백악관에 따르면 정상의 이번 화상 정상회담은 오전  시작해 오전   이뤄졌다 화상으로 이뤄지긴 했지만 바이든 대통령과 기시다 총리가 회담을 가진 것은 기시다 총리 취임 이후 처음이다 앞서 정상은 작년  영국 글래스고에서 열린 제26차 유엔 기후변화협약 당사국총회 COP26 에서 잠깐 대면한 적이 있고 지난  전화통화를 가진 있다,국제,20220122,뉴스1,"바이든 ""기시다 만나 영광..미일 동맹, 평화·안보 초석"""
영국 보건안전청 HSA 신종 코로나바이러스 감염증 코로나19 유전자증폭 PCR 검사로도 다른 변이들과 구분하지 못하는 스텔스 오미크론 변이 BA 조사대상으로 지정했다고 로이터통신이  현지시간 보도했다 세계보건기구 WHO 따르면 오미크론은 확진자 샘플의 PCR 검사 결과 에스 유전자 표적 실패 SGTF gene target faillure 나타나는 경우 등을 추려 추적하고 있는데 스텔스 오미크론은 기존 오미크론과 유사함에도 S유전자표적실패가 이뤄지지 않아 검출이 어렵다 영국에서는  해당 변이가  확인됐다 지난달 남아프리카공화국과 호주 캐나다에서  발견된 스텔스 오미크론 변이는 이후 덴마크와 노르웨이 인도 캘커타에서도 발견되면서 검출국은  늘었다 HSA 소속 미라 찬드 박사는 바이러스는 진화하는 특성을 가졌기 때문에 새로운 변이가 계속 나타날 이라며 우리는 지속적인 유전체 감시를 통해 새로운 변이가 치명적인지를 계속 확인할 이라고 밝혔다 한편 전문가들은 이미 스텔스 오미크론을 기존 오미크론의 하위 계통 으로 분류하고 있지만 덴마크 초기 연구에서는 스텔스 오미크론 변이의 입원율이 원래 오미크론 변이와 차이가 없는 것으로 나타났다 다만 연구소 샘플 담당자인 마츠 마르티넬 연구원은 스텔스 오미크론의 발견은 그리 놀라운 일은 아니다 감염이 많이 이뤄질수록 변이 출현 가능성은 커지기 때문 이라며 훨씬 많은 하위계통 변이들이 있을 이라고 말했다 요한 레너스트란트 웁살라대 미생물학 교수는 변이의 전염력과 중증도를 판단하기엔 아직 이르다 전했다,국제,20220122,뉴스1,"英, '검출 어려운' 스텔스 오미크론 53건 확인..조사대상 지정"
일본 오이타현 사이키시 인근 해안서  오전  규모  지진이 발생했다고 NHK가 보도했다 보도에 따르면 진원지는 휴가나다 해상이고 지진의 깊이는  다행히 해당지진으로 쓰나미 경보가 발령되지는 않았다 오이타현 벳푸시 경찰 관계자는 지진 발생 직후 매우 흔들림이 있었다 현재 피해 상황에 대해 확인중이라고 전했다 미국 지질조사국은 USGS 해당 지진의 규모를 처음에  확인했지만 이후  정정했다 지진의 깊이는  확인했다,국제,20220122,뉴스1,"日 오이타현 인근 해안서 규모 6.4 지진 발생..""큰 흔들림 있었다""(상보)"
미국을 시작으로 많은 국가들이 신장 위구르 지역 인권 문제를 지적하며 베이징 올림픽에 외교적 보이콧 선언한 가운데 유엔 총회 의장이 대막식 참가를 결정했다 이는 안토니오 구테흐스 유엔 사무총장에 이어 유엔 최고위급 인사들 두번째 올림픽 참석 결정이다 로이터 통신에 따르면  현지시간 중국 외교부는 몰디브 정치인인 압둘라 샤히드 유엔 총회 의장이 다음달  개막하는 베이징 동계올림픽 성화봉송에 참가할 것이라고 밝혔다 자오 리젠 중국 외교부 대변인은 이날 정례 기자회견에서 우리는 샤히드가 올림픽에 참석하고 성화봉송 주자로 나서는 것을 환영한다 그는 우리가 개최하는 올림픽에 확실한 지지 표명했다 말했다 이어 베이징 동계 올림픽은 과학기술 진보를 비롯해 중국의 가장 좋은 면과 인류의 가장 좋은 면을 보여줄 것이라고 믿는다 덧붙였다 동계올림픽 참석을 결정한 샤히드 의장은 지난  총회에서 대회 기간동안 전세계 전쟁지역에서 올림픽 휴전 유지할 것을 촉구했다 그는 유엔 회원국들에게 올림픽 휴전에 대한 그들의 헌신을 보여줄 것을 엄숙히 호소한다 우리는 휴전 정신을 바탕으로 평화와 화합의 문화를 증진하고 강화하기 위해 지역 국가 지역 세계 차원에서 구체적인 행동을 취할 이라고 전했다 한편 이번 올림픽은 미국을 필두로 호주 영국 캐나다 일본 등이 외교적 보이콧 선언하며 냉랭한 분위기로 흘러가고 있다 뉴질랜드를 비롯한 몇몇 국가들은 엄격한 코로나19 규제를 근거로 올림픽에 외교 인사 파견을 거부하기도 했다 다만 안토니우 구테흐스 유엔 사무총장과 블라디미르 푸틴 러시아 대통령 카심-조마르트 토카예프 카자흐스탄 대통령 임란 파키스탄 총리 등은 올림픽 개막식에 참석한다,국제,20220122,뉴스1,"유엔 총회 의장, 베이징 올림픽 성화봉송 주자 나선다"
프랑스 보건당국이 성인을 대상으로 화이자 신종 코로나바이러스 감염증 코로나19 먹는 치료제 팍스로비드 대한 사용을 승인했다고 파리지앵이  현지시간 보도했다 보도에 따르면 프랑스 고등보건청 HAS 코로나19에 확진돼 산소 호흡기를 착용하지 않더라도 중증으로 이어질 위험이 모든 성인들에게 팍스로비드 투약을 승인한다고 밝혔다 또한 연령에 관계없이 중증환자나 면역 취약계층들에게도 해당 치료제의 사용을 승인했다 한편 팍스로비드는 인체면역결핍바이러스 HIV 치료제인 리토나비르와 혼합 투여할 경우 코로나19 환자의 중증 전환 사망 위험을 까지 줄일 있는 것으로 알려졌다 특히 이스라엘에서는 지난  팍스로비드 복용한 사람들 사흘만에 증상이 크게 호정전됐다는 연구결과가 나오기도 했다 팍스로비드는 코로나19 감염 증상을 보인  안에 복용을 권장하며  매일  먹도록 하고 있다,국제,20220122,뉴스1,프랑스도 성인 대상 화이자 먹는 치료제 사용 승인
미국과 일본 정상은  현지시간 최근 잇따른 북한의 탄도미사일 시험발사를 규탄하며 한반도의 완전한 비핵화를 위해 한국을 포함해  긴밀한 공조를 유지하기로 했다 바이든 대통령과 기시다 후미오 일본 총리가  화상 정상회담을 갖고 이같이 의견을 모았다고 백악관이 보도자료를 통해 전했다 백악관에 따르면 정상은 유엔 안전보장이사회의 결의를 위반한 북한의 최근 탄도미사일 발사에 대해 규탄했다 정상은 이어 한반도의 완전한 비핵화를 위해 한국과 보조를 맞춰 북한 문제에 대해 긴밀한 조율을 유지하기로 약속했다 바이든 대통령은 일본인 납치 문제의 즉각적인 해결에 대한 지지를 표명했다고 백악관은 전했다 바이든 대통령이 최근 북한이 잇따른 탄도미사일 시험발사한 이어 핵실험 대륙간탄도미사일 ICBM 시험발사 재개를 시사한 이후 북한에 대한 입장을 밝힌 것은 이번이 처음이다 정상은 우크라이나에 대한 러시아의 침략을 저지하기 위해 긴밀히 협력하기로 약속했으며 기사다 총리는 어떠한 공격에도 강력한 조치를 취하는 것에 대해 미국과 다른 동맹국 파트너 국제사회와 함께 긴밀한 조율을 지속해 나가기로 다짐했다 바이든 대통령과 기시다 총리는 공동의 도전들에 대처하기 위해 미국과 일본 한국간 긴밀한 협력의 중요성을 확인했으며 미국과 일본 한국의  관계가 안보는 물론 폭넓게 이뤄져야 한다고 강조했다 이와 함께 정상은 중국에 대한 대응에 있어 공조 의지도 재확인했다 정상은 동중국해와 남중국에서 현상태를 바꾸려는 중국의 시도에 맞설 것을 다짐하고 대만해협의 평화와 안정의 중요성 양안 문제의 평화적 해결을 강조했다 또한 인권 침해 비판을 받고 있는 신장과 홍콩 등에서의 중국의 관행에 대한 우려를 공유했다 바이든 대통령은 센카쿠 열도에 대해 상호안보 조약이 적용된다는 점을 단호히 단언했고 모든 역량을 동원해 일본의 방위에 대한 미국의 변함없는 공약을 확인했다 정상은 자유롭고 개방된 인도 태평양 지역을 촉진하기 위한 미국 일본 인도 호주가 참여하는 쿼드 Quad 중요성을 강조하고 쿼드가 신종 코로나바이러스 감염증 코로나19 같은 분야에서 실질적인 결과를 제공할 있도록 결의했다 백악관은 쿼드 정상회의를 상반기에 일본에서 열기로 했다는 것을 소개하면서 바이든 대통령이 기시다 총리의 초청을 환영했다고 설명했다 정상은 미국과 일본의 경제적 유대를 심화하기로 했다면서 양국 외교 경제 장관이 참여하는 경제정책협의회 신설하기로 했다 정상은 바이든 대통령이 강화하겠다고 약속했던 인도 태평양 지역에서 미국의 경제적 리더십 중요성을 확인하고 기시다 총리는 바이든 대통령이 제안한 인도태평양 경제 프레임워크 대해 강한 지지를 표명했다고 백악관은 전했다 아울러 바이든 대통령은 기시다 총리가 국가안보전략과 다른 핵심 문서를 수정하려는 의지와 방위비 지출을 늘리려는 결단을 환영했다고 백악관은 설명했다,국제,20220122,뉴스1,"미일 정상 ""北미사일 규탄..완전한 비핵화 위해 한미일 긴밀 공조"""
,국제,20220122,뉴스1,"[속보] 테슬라 5.26% 급락, 943.90 달러에 마감"
미국 정부가 중국이신종 코로나바이러스 감염증 코로나19 확산을 막는다는 명목으로 미국 일부 비행기를 입국금지 것에 맞불을 놨다 로이터 통신에 따르면 국토교통부는  현지시간 중국  항공사 항공편  대해 운항중단 조치를 내렸다고 밝혔다 이번 조치에 적용되는 항공사는 샤먼 에어차이나 중국남방항공 중국동방항공 등이다 조치는 오는  캘리포니아주 로스앤젤레스를 떠나 중국 푸젠성 샤먼으로 향하는 샤먼항공의 항공기부터 적용되고  지속될 예정이다 국토교통부의 조치는 중국이 코로나19 방역을 이유로 미국 항공사 항공편의 중국 입국을 막은 따른 보복 조치의 성격이 강하다 앞서 중국 당국은 지난달  이후 유나이티드항공  아메리칸항공  델타항공  대해 중국 입국 중단 조치를 내린바 있다 당시 미국 교통부는 중국의 조치에 대해 공공의 이익에 역행하는 이라며 중국의 일방적인 행동은 합의에 어긋난다 비판했다,국제,20220122,뉴스1,"'中 항공기 44편 운항중단 조치' 美, 자국 항공기 입국 금지에 '맞불'"
